index,titulo,empresa,ubicacion,salario,modalidad,jornada,tipo_contrato,fecha_publicacion,descripcion,url
17,Qa Automation Senior,Sofka Technologies,"Quito, Pichincha",,,Tiempo completo,,Hace 1 día,"¿Estás buscando nuevos desafíosy un lugar donde puedas disfrutar de un ambiente cercano mientrasaprendesconstantemente? Bienvenido a un equipo con un propósito claro:""TRANSFORMARla vida de las personas siendo el aliadoTECNOLÓGICOmás confiable"" Prepárate y únete a esta aventura¿Qué encontrarás? Retos técnicos y personales que te mantendrán en constante crecimiento. Un equipo conectado, enfocado en tu bienestar físico y mental.Cultura de mejora continua, fresca y colaborativa, con oportunidades de aprendizaje y gente dispuesta a apoyarte.KaizenHub, un programa diseñado para potenciar tus talentos, con feedback, mentorías y coaching a través de Sofka U. Será un reto y un juego a la vez Programas como Happy Kaizen y WeSofka que cuidan tu bienestar físico y emocional. ¿Qué buscamos? Buscamos unQA Automation Seniorcon al menos 5 años de experiencia, apasionado por la excelencia y listo para tomar las riendas de nuestra estrategia de calidad. Tu misión será dirigir y ejecutar pruebas manuales y automáticas, implementando las mejores prácticas internacionales en pruebas funcionales, no funcionales y de performance para garantizar la robustez de nuestros desarrollos de software.Este rol es una oportunidad única para liderar las métricas de calidad que guíen nuestro éxito y mejorar continuamente nuestros procesos de automatización. Si buscas un desafío donde tu visión y experiencia técnica generen un impacto directo en el producto, este es tu lugar. ¿Qué harás? Dirigir y ejecutar pruebas manuales y automáticas para desarrollos de software complejos.Diseñar e implementar métricas de calidad de software, como cobertura de pruebas y cantidad de errores.Gestionar, dirigir y liderar equipos de trabajo, fomentando su desarrollo y la excelencia técnica.Mejorar continuamente los procesos y flujos de automatización de pruebas para aplicaciones web, móviles y backend.Diseñar estrategias y planes de prueba basados en análisis de riesgos y criterios de aceptación en formato BDD.Implementar y gestionar la estrategia de pruebas de performance, analizando los resultados para proponer mejoras.Gestionar el ciclo de vida de los defectos y asegurar la documentación adecuada para la finalización de pruebas.Contribuir activamente en la implementación de prácticas de integración y despliegue continuo (CI/CD). ¿Qué buscamos? Metodologías y Procesos: Procesos de pruebas (ISTQB FL/AT), BDD (Gherkin, Cucumber), análisis de riesgos de calidad, prácticas ágiles.Automatización y Performance: Serenity BDD, ScreenPlay, Karate, K6, JMeter, Appium, Robot Framework, Rational Performance Tester.Herramientas de Gestión: Jira (X-ray), Confluence.CI/CD y Versionamiento: Azure DevOps, GIT, manejo de pipelines.Bases de Datos: SQL, Oracle, DB2, PostgreSQL.Analítica de Datos: Implementación y valoración de modelos de analítica de datos aplicados a la calidad.RequisitosExperiencia: Mínimo 5 años de experiencia en roles de QA, dirigiendo y ejecutando pruebas manuales y automatizadas (funcionales y no funcionales), diseñando estrategias de prueba y liderando equipos de trabajo en entornos ágiles.Es plus si cuentas con:Certificación ISTQB.PRESENTATEy sé parte de esta historiaCondicionesContrato a término indefinido Queremos relaciones a largo plazo y que seas parte de nuestra familia por mucho tiempo¿Buscas crecimiento profesional? En Sofka, te ofrecemos un ecosistema de aprendizaje con múltiples herramientas para cerrar brechas y potenciar tus habilidades. Tú decides cómo quieres crecer Modalidad: una semana al mes presencial en Quito. <p class=""source"" data-source=""Buscojobs"" data-site=""www.buscojobs.com.ec""> Buscojobs </p>",https://www.opcionempleo.ec/jobad/ec85bbeb83ead69c5aee55913129ffee94
18,Software Qa Tester,Sofka Technologies,"Quito, Pichincha",,,Tiempo completo,Permanente,Hace 1 día,"Únete a un equipo que combina experiencia técnica y compromiso con el servicio público. Si tienes al menos 4 años de experiencia y buscas un entorno que valore tu talento, tu capacidad de innovar y tu deseo de impactar positivamente en el país, el SRI es tu lugar.Ubicación: Quito (modalidad presencial) Institución: Servicio de Rentas Internas (SRI) Formación Académica• Título de tercer nivel registrado en SENESCYT en Ciencias Informáticas y Sistemas Experiencia Requerida• Experiencia general: Mínimo 4 años de experiencia laboral. <ul> <li>Experiencia específica: 4 años demostrables en aseguramiento de calidad de servicios tecnológicos, incluyendo actividades como:• Ejecución de planes y guiones de prueba, incluyendo controles de seguridad.</li> <li>Revisión de despliegues para certificar la correcta implementación de servicios.</li> <li>Diagnóstico e interpretación de errores en ambientes de prueba, con colaboración en su solución.</li> <li>Configuración y revisión de entornos de pruebas.</li> <li>Automatización de pruebas y despliegues mediante YAML, Ansible o scripts especializados.</li> </ul> Capacitaciones valoradasConocimientos o formación en: • Marcos de referencia y herramientas de control de calidad • Programación en plataformas JEE u Oracle • Administración de servidores de aplicación JEE Conocimientos deseables (no excluyentes) • Gestión de pruebas bajo marcos como Scrum, ITIL, ISTQB • Metodología DevOps • Herramientas de automatización como Ansible • Automatización de pruebas • Uso de JBoss, SonarQube, PL/SQL • Manejo de contenedores (Docker, Kubernetes) • Conocimiento en bases de datos no relacionales (NoSQL) Idioma requerido • Español (nivel profesional) Competencias técnicas • Habilidad analítica (priorización, pensamiento lógico, sentido común) • Identificación y solución de problemas técnicos • Conocimientos en programación y control de calidad Competencias conductuales • Autocontrol y gestión emocional • Capacidad de evaluación y seguimiento de soluciones • Manejo eficaz del tiempo y enfoque en resultados • Aprendizaje autónomo • Atención al detalle • Orientación al servicio y trabajo colaborativo <p class=""source"" data-source=""Buscojobs"" data-site=""www.buscojobs.com.ec""> Buscojobs </p>",https://www.opcionempleo.ec/jobad/ecb92d8fb319a432daa0606c97cf7f50e0
19,Analista Qa,Sipecom S.A.,"Guayaquil, Guayas",,,Tiempo completo,Permanente,Hace 3 días,"Únete a nuestro equipo comoAnalista QA Semi Senior ¿Tienes experiencia en pruebas de software, validación de requerimientos y manejo de bases de datos? EnSipecom S.A.estamos buscando tu perfil para garantizar la calidad de soluciones tecnológicas de alto impactoSobre nosotros:Sipecom S.A.es una empresa con más de 23 años de experiencia en el mercado ecuatoriano, especializada en el desarrollo e implementación de soluciones tecnológicas innovadoras como ERP, CRM y plataformas personalizadas. Nuestro compromiso es asegurar la calidad y confiabilidad en cada producto, apoyando a organizaciones de distintos sectores a optimizar sus procesos mediante innovación y tecnología.Lo que buscamos:Formación:Ingeniería o Licenciatura en Sistemas, Tecnologías de la Información o afines.Experiencia mínima requerida:3 años en adelante.Experiencia comprobada en:Pruebas funcionales y no funcionalesAnálisis de requerimientosManejo de bases de datos SQL ServerCasos y documentación de pruebasExperiencia con JMeter (deseable)Lo que valoramos en ti: Atención al detalle Trabajo en equipo Compromiso y responsabilidad Interesados, por favor enviar su hoja de vida ao etiqueta a alguien que pueda estar interesado.Tu próximo reto profesional te está esperando enSipecom S.A. <p class=""source"" data-source=""Buscojobs"" data-site=""www.buscojobs.com.ec""> Buscojobs </p>",https://www.opcionempleo.ec/jobad/ec54575d9a349910692af4d5ce1ad2b553
20,Qa Automation New,Neoris,"Quito, Pichincha",,,Tiempo completo,Permanente,Hace 4 días,"NEORIS es un acelerador Digital que ayuda a las compañías a entrar en el futuro, teniendo 20 años de experiencia como Socios Digitales de algunas de las mayores compañías del mundo. Somos más de 4,000 profesionales en 11 países, con nuestra cultura multicultural de startup en donde cultivamos innovación, aprendizaje continuo para crear soluciones de alto valor para nuestros clientes.Estamos en búsqueda de QA Automation,Principales responsabilidades:Contribución activa de la definición de criterios de aceptación de las historias de usuario o requierimientosDiseñar estrategias y planes de prueba en base a las Historias de usuario definidas por el equipo, en formato BDDDiseñar casos de prueba tanto funcionales como no funcionalesEjecutar la estrategia de pruebas definida (pruebas funcionales y no funcinoales)Realizar la gestión de defectosRealizar la documentación requerida para la finalización de pruebasRealizar el levantamiento y gestión de riesgos de calidadRealizar el levantamiento de flujos candidatos de automatización.Gestionar flujos automatizados e implementar la automatizacion de pruebas para aplicaciones desde el frontend (web, móviles) y backend (servicios). Diseñar e implementa métricas de calidad de software (Cantidad de bugs,cobertura de pruebas,calidad de código, etc)Trabajar con código fuente a los repositorios de versionamientoRequerimientos:Tener conocimiento en herramientas de gestión de prueba de software entre 3 a 5 añosJira (X-ray)ConfluenceSerenityBDDScreenPlayGherkin - CucumberKarateGradleJmeterAppiumK6SQL, ORACLE, DB2,POSTGRESAzure CI/CDOfrecemos:Vinculación a tiempo indeterminadoBeneficios legalesSeguro médico privadoPóliza de vidaDía libre de cumpleañosTe invitamos a conocernos en , Facebook, LinkedIn, Twitter o Instagram: @NEORIS.Manuel LunahuanaLI-ML2 <p class=""source"" data-source=""Buscojobs"" data-site=""www.buscojobs.com.ec""> Buscojobs </p>",https://www.opcionempleo.ec/jobad/ecaa02346b948e48f4de65e0b45a00bb7e
21,Qa Automation Engineer,Devsu,"Guayaquil, Guayas",,,Tiempo completo,Permanente,Hace 5 días,"Buscamos un/a Ingeniero/a QA Automation con experiencia comprobada en pruebas automatizadas de software. Esta posición es híbrida en Quito/Ecuador.Funciones:Diseñar, desarrollar y ejecutar pruebas automatizadas para validar funcionalidades.Colaborar con el equipo de desarrollo y producto para entender requerimientos y criterios de aceptación.Documentar y reportar defectos de manera clara y precisa.Participar en la definición de estrategias de prueba.Ejecutar pruebas en entornos que incluyan modelos de datos complejos.Desarrollar scripts de pruebas y mantenerlos actualizados.Validar calidad de datos y funcionamiento en bases de datos SQL y NoSQL.Utilizar herramientas de automatización de pruebas como Cypress, Karate, Serenity, K6, entre otras.Apoyar la mejora continua de los procesos de testing.RequirementsMínimo 2 años de experiencia comprobada como Ingeniero QA.Experiencia en automatización de pruebas de software.Habilidades de programación básicas a intermedias.Experiencia en pruebas de software, preferiblemente en entornos de desarrollo de modelos de datos.Conocimiento en metodologías de pruebas y diseño de casos de prueba.Manejo de bases de datos SQL y NoSQL.Experiencia con herramientas de automatización como Serenity, Karate, K6, Cypress, Protractor, TestCafe, Appium, entre otras.Deseables:Certificación ISTQB o similar.Conocimiento de buenas prácticas de desarrollo: Git, TDD, revisiones de código, CI/CD.Experiencia en herramientas RPA (Robotic Process Automation). Experiencia previa en entornos ágiles.BenefitsEn Devsu, queremos crear un ambiente donde puedas prosperar tanto personal como profesionalmente. Al unirte a nuestro equipo, disfrutarás de:Un contrato estable a largo plazo con oportunidades de crecimiento profesionalSeguro médico privadoProgramas continuos de capacitación, mentoría y aprendizaje para mantenerte a la vanguardia de la industriaAcceso gratuito a recursos de capacitación en IA y herramientas de IA de última generación para elevar tu trabajo diarioUna política flexible de tiempo libre remunerado (PTO) además de días festivos pagadosProyectos de software desafiantes de clase mundial para clientes en Estados Unidos y LatinoaméricaColaboración con algunos de los ingenieros de software más talentosos de Latinoamérica y Estados Unidos, en un entorno de trabajo diversoÚnete a Devsu y descubre un lugar de trabajo que valora tu crecimiento, apoya tu bienestar y te empodera para generar un impacto global. <p class=""source"" data-source=""Buscojobs"" data-site=""www.buscojobs.com.ec""> Buscojobs </p>",https://www.opcionempleo.ec/jobad/ec9299755a9248e16e681cb714dfb0ed28
22,Pasante De Qa,American Call Center,"Guayaquil, Guayas",,,Tiempo completo,Permanente,Hace 5 días,"Ven y forma parte de la gran familia de CONAUTO C.AResponsabilidades:Apoyar en la ejecución de pruebas funcionales, regresión y usabilidad.Colaborar con el equipo de desarrollo en la identificación y reporte de errores.Apoyar en la elaboración de casos de prueba y escenarios de validación.Participar en reuniones de seguimiento con el equipo de QA y desarrollo.RequisitosEstudiantes de últimos semestres de Ingeniería en Sistemas, Software, Informática o afines . Habilidad para trabajar en equipo y atención al detalle.Carta de pasantías.Aplicar únicamente si cumples con el perfil requerido.Te invitamos a formar parte de la gran familia Conauto, el mejor socio estratégico del Ecuador. <p class=""source"" data-source=""Buscojobs"" data-site=""www.buscojobs.com.ec""> Buscojobs </p>",https://www.opcionempleo.ec/jobad/eccb58c1a9e8d64a11abd180ddadc190a7
23,Especialista Qa,BGR,"Quito, Pichincha",,,Tiempo completo,Permanente,Hace 5 días,"¿Eres apasionado por la calidad del software y cuentas con experiencia sólida en pruebas? Buscamos unEspecialista QApara fortalecer nuestro equipo.Requisitos:Título de tercer nivel en Sistemas o afines . Mínimo 5 años de experiencia en QA.Conocimientos en metodologías ágiles (Scrum). Manejo de herramientas: Jira, Azure Test Plans, Zephyr . Automatización de pruebas frontend con Selenium o Cypress . Validación de APIs con Postman y Swagger/OpenAPI . Experiencia en frameworks de testing unitario (JUnit, TestNG, xUnit, MSTest). Reportes con Allure, ReportPortal, ExtentReports . Experiencia en entornos Java Spring Boot, . NET Core, Angular y microservicios . Conocimientos de RPA (Microsoft Power Automate) . Experiencia con Azure Pipelines, App Services, VMs, Container Registry y Docker . Certificación deseable: ISTQB CTFL . <p class=""source"" data-source=""Buscojobs"" data-site=""www.buscojobs.com.ec""> Buscojobs </p>",https://www.opcionempleo.ec/jobad/ec01eb8c46d427ed1debd1bb7cd279a32c
24,A Middle Qa,Evaluar,"Quito, Pichincha",,,Tiempo completo,Permanente,Hace 5 días,"MIDDLE QA (QUALITY ASSURANCE) ENGINEER en EVALUARÚnete a nuestro equipo en EVALUAR IT como MIDDLE QA ENGINEER y asegura la calidad de nuestros productos de desarrollo web. Buscamos un profesional comprometido con la excelencia y la mejora continua.Principales Tareas y ResponsabilidadesDiseñar y ejecutar casos de prueba para aplicaciones web.Identificar y documentar defectos de software.Colaborar con desarrolladores para resolver problemas.Participar en revisiones de código y pruebas de integración.Garantizar el cumplimiento de estándares de calidad.RequisitosExperiencia en pruebas de software y control de calidad.Conocimiento de herramientas de automatización de pruebas.Habilidad para trabajar en equipo y comunicarse efectivamente.Capacidad para analizar y resolver problemas complejos.Conocimiento de metodologías ágiles.BeneficiosAmbiente de trabajo colaborativo.Oportunidades de desarrollo profesional.Salario competitivo.Capacitación continua.Flexibilidad laboral.Principales HabilidadesAtención al detalle.Comunicación efectiva.Resolución de problemas.Trabajo en equipo.Adaptabilidad.Capacidad analítica. <p class=""source"" data-source=""Buscojobs"" data-site=""www.buscojobs.com.ec""> Buscojobs </p>",https://www.opcionempleo.ec/jobad/ecf386b7b98e4aca37e0119301acce9043
25,Coordinador Qa Qc,Sedemi,"Quito, Pichincha",,,Tiempo completo,Permanente,Hace 5 días,"Responsable del control y elaboración dossier de calidad para trabajos de metalmecánica, como tanques, silos, estructuras entre otros, de acuerdo a los requerimientos y especificaciones técnicas del cliente y la liberación con fiscalizadores externosFormación:Ing. MecánicoExperiencia· Mínimo 2 años en el sector metalmecánico elaborando dossier de calidad· Relacionarse con fiscalizadores externos de empresa públicas y privadas para la liberación de productos· Manejo de normas, Código ASME, API, AWS D1.5· END· Inspección en ObrasCOMPETENCIA· Conocimiento en herramientas de Mediciones· Procedimientos de tipos de soldadura· Conocimiento de materiales para la fabricación de tanques en acero negro e inoxidable· Manejo de normas ASME, API, AWS D1.5· Inspección visual de soldadura, calificación de soldadores. · Supervisión de construcción y montajes en él área metalmecánica.HABILIDADES PROFESIONALESOrganizadoCriterio para plantear y resolver posibles soluciones o cambiosCapacidad de comunicación y trabajo en equipoManejo de utilitarios: ExcelOFRECEMOSRemuneración fijaAfiliación al IESSSubsidio alimentación 50%Enviar su HV al correo:, asunto coordinador QA QC <p class=""source"" data-source=""Buscojobs"" data-site=""www.buscojobs.com.ec""> Buscojobs </p>",https://www.opcionempleo.ec/jobad/ecc482bd6bd3b0b14059e2a47c35ea0d51
26,Qa Automation,Neoris,"Quito, Pichincha",,,Tiempo completo,Permanente,Hace 5 días,"NEORIS es un acelerador Digital que ayuda a las compañías a entrar en el futuro, teniendo 20 años de experiencia como Socios Digitales de algunas de las mayores compañías del mundo. Somos más de 4,000 profesionales en 11 países, con nuestra cultura multicultural de startup en donde cultivamos innovación, aprendizaje continuo para crear soluciones de alto valor para nuestros clientes.Estamos en búsqueda de QA Automation,Principales ResponsabilidadesContribución activa de la definición de criterios de aceptación de las historias de usuario o requierimientosDiseñar estrategias y planes de prueba en base a las Historias de usuario definidas por el equipo, en formato BDDDiseñar casos de prueba tanto funcionales como no funcionalesEjecutar la estrategia de pruebas definida (pruebas funcionales y no funcinoales)Realizar la gestión de defectosRealizar la documentación requerida para la finalización de pruebasRealizar el levantamiento y gestión de riesgos de calidadRealizar el levantamiento de flujos candidatos de automatización.Gestionar flujos automatizados e implementar la automatizacion de pruebas para aplicaciones desde el frontend (web, móviles) y backend (servicios). Diseñar e implementa métricas de calidad de software (Cantidad de bugs,cobertura de pruebas,calidad de código, etc)Trabajar con código fuente a los repositorios de versionamientoRequerimientosTener conocimiento en herramientas de gestión de prueba de software entre 3 a 5 añosJira (X-ray)ConfluenceSerenityBDDScreenPlayGherkin - CucumberKarateGradleJmeterAppiumK6SQL, ORACLE, DB2,POSTGRESAzure CI/CDOfrecemosVinculación a tiempo indeterminadoBeneficios legalesSeguro médico privadoPóliza de vidaDía libre de cumpleañosTe invitamos a conocernos en , Facebook, LinkedIn, Twitter o Instagram: @NEORIS.Manuel Lunahuana <p class=""source"" data-source=""Buscojobs"" data-site=""www.buscojobs.com.ec""> Buscojobs </p>",https://www.opcionempleo.ec/jobad/ec290426b13e3499988e93cca55e9542fc
27,Qa Project Expert,Grunenthal Group,"Quito, Pichincha",,,Tiempo completo,Permanente,Hace 5 días,"Job Grade:TEC11Hiring Manager:Mercedes Margarita Herrera NuñezEmpleado | Temporal | A tiempo completo | In situ¿Tienes una mentalidad emprendedora? ¿Quieres unirte a un equipo dinámico con un fuerte sentido de propósito que prospera al encontrar nuevas formas de abordar los desafíos? Entonces, nuestro equipoCommercial, Marketing &amp; Saleses el adecuado para ti, si te apasiona el Marketing, los asuntos Médicos, el Acceso al Mercado, la Excelencia Comercial o las Ventas. Analizamos el mercado para entender exactamente qué necesitan los pacientes y luego proporcionamos tratamientos que mejoren su calidad de vida, al mismo tiempo que creamos valor para Grünenthal. Nos esforzamos por avanzar hacia nuestra visión de un mundo sin dolor, cada día para cada paciente. Nos encantaría que nos ayudases a tener un impacto positivo en la vida de las personas que sufren dolor en todo el mundo.Como es el trabajoCada Día Disfrutarás De Diversos Retos ComoSupervisar el sistema de gestión documental, actuando como administrador de documentos en el eQMS y coordinador de entrenamientos.Revisar y validar las calibraciones y calificaciones de sistemas y equipos de la planta, asegurando el cumplimiento con los estándares de calidad.Proponer e implementar estrategias de mejora y excelencia operativa en las diferentes áreas de la planta.Dar soporte en la evaluación y análisis de quejas relacionadas con los proveedores, gestionando soluciones efectivasTu AportaciónPara aprovechar al máximo este rol, deberás contar con:Título profesional en Química Farmacéutica o Ingeniería Química con tarjeta profesional vigente.Inglés avanzado: Es un requisito imprescindible debido a la interacción constante con equipos internacionales.Experiencia mínima de 2-3 años en la industria farmacéutica, especialmente en fabricación de sólidos, semisólidos y líquidos.Conocimientos sólidos en Sistemas de Gestión de Calidad (SGC), validaciones de procesos y calificaciones de equipos.Habilidades de autogestión para planificar y llevar a cabo tareas con independencia y eficacia.Capacidad de toma de decisiones y criterio analítico para evaluar opciones y seleccionar las mejores alternativas en gestión documentalComunicación asertiva y capacidad de influencia para facilitar la implementación de mejoras dentro de la organización.Experiencia/conocimiento DeseablesEstudios de postgrado o experiencia en áreas relacionadas con aseguramiento de calidad o gestión de procesos.Familiaridad con herramientas de mejora continua, como Lean Six Sigma.Experiencia en el manejo de sistemas de gestión documental eQMS. <p class=""source"" data-source=""Buscojobs"" data-site=""www.buscojobs.com.ec""> Buscojobs </p>",https://www.opcionempleo.ec/jobad/ec9ed2d9463f0e0f60396e62c154506959
28,Qa Prueba De Genero 2,Evaluar,"Quito, Pichincha",,,Tiempo completo,Permanente,Hace 5 días,"Consejos: Haz un resumen del puesto, explica qué se necesita para triunfar en él y el lugar que ocupa en la empresa.Responsabilidades(Describe con precisión todas las responsabilidades. Usa un lenguaje inclusivo.)Ejemplo: Definir y desarrollar los requisitos para los sistemas en fase de producción para garantizar la máxima facilidad de uso.Requisitos(Algunos requisitos que podrías incluir: aptitudes, estudios, experiencia o certificados.)Ejemplo: Excelentes dotes para la comunicación oral y escrita.RECUERDA QUE AL DAR CLIC ENPOSTULARMEDEBERÁS COMPLETAR TUS EVALUACIONES EN TU PÁGINA DE CANDIDATO. <p class=""source"" data-source=""Buscojobs"" data-site=""www.buscojobs.com.ec""> Buscojobs </p>",https://www.opcionempleo.ec/jobad/eca0f5100a6f14d6eef9a2800933632134
