index,titulo,empresa,ubicacion,salario,modalidad,jornada,tipo_contrato,fecha_publicacion,descripcion,url
40,Data Science Teaching Experts LATAM,TripleTen,"Quito, Pichincha",$700,,Tiempo parcial,Permanente,Hace 1 mes,"es un servicio que empodera a las personas, sin importar su experiencia previa, para embarcarse en el emocionante y desafiante camino de dominar profesiones tecnológicas. Nuestros bootcamps se enfocan en capacitar a los estudiantes en Análisis de datos, Ciencia de datos, Desarrollo web y Ingeniería de aseguramiento de calidad (QA) y Diseño UX/UI de una manera accesible y viable, llevándolos finalmente a prosperar en una nueva carrera. Nuestra misión es garantizar que cada estudiante tenga la oportunidad de dominar con éxito una nueva profesión, encontrar su propósito y convertirse en un miembro valioso de la industria tecnológica. ¿Cuál es nuestro objetivo? Estamos en búsqueda continua de profesionales con experiencia en Ciencia de datos, para acompañar y ayudar a nuestros estudiantes a convertirse en desarrolladores profesionales. Puedes unirte a nosotros a tiempo parcial, dedicando de 10 a 30 horas por semana, según tu disponibilidad. Postúlate aquí — revisamos las solicitudes de manera continua e invitamos a los candidatos seleccionados a grabar un video respondiendo algunas preguntas y a realizar una tarea de prueba. Si hay una vacante disponible, te la asignaremos de inmediato; si no, guardaremos tu perfil y la tarea completada para futuras oportunidades. Por favor, envía tu CV en inglés. What you will do: Hay tres roles de enseñanza para los estudiantes: Tutores, Instructores y Revisores de Código. Los Tutores apoyan a los estudiantes respondiendo sus preguntas y brindando orientación práctica a través de: <ul> <li>Realización de webinars en vivo (una o dos veces por semana).</li> <li>Chats con los estudiantes.</li> <li>Sesiones de codificación en vivo (una sesión cada dos semanas).</li> </ul> ⌛ Este rol requiere 12 a 15 horas de disponibilidad, con énfasis en el horario de 7pm a 10pm hora CDMX (lunes a viernes). Como Instructor, tu misión es ayudar a los estudiantes a resolver todas sus dudas sobre el contenido del programa y guiarlos a través de ejercicios y proyectos. Tú: <ul> <li>Asistirás a los estudiantes vía Discord, en canales escritos y de voz.</li> <li>Realizarás sesiones de preguntas y respuestas (Q&amp;A).</li> </ul> ⌛ Este rol requiere 12 a 15 horas de disponibilidad, con énfasis en el horario de 7pm a 10pm hora CDMX (lunes a viernes). ﻿ Como Revisor de Código, revisarás los proyectos de los estudiantes y proporcionarás retroalimentación. La comunicación con los estudiantes se realiza a través de chat. ⌛ Este rol es flexible y requiere hasta 30 horas de disponibilidad por semana, de lunes a viernes. ﻿ Y lo más importante: ¡serás una fuente de inspiración para tus estudiantes! What we can offer you: <ul> <li>Capacitación en técnicas de mentoría y comunicación.</li> <li>La posibilidad de enseñar mientras desempeñas tu trabajo principal.</li> <li>Compartir experiencia con desarrolladares dentro de nuestra comunidad.</li> <li>Ingresos promedio de $700 a $1500 USD al mes por una colaboración flexible de medio tiempo, con gran impacto ¡y un equipo increíble!</li> <li>Experiencia de colaboración intercultural en mentoría y realización de webinars.</li> <li>Cooperación remota con un horario conveniente tanto para ti como para el equipo. No nos enfocamos en la microgestión.</li> <li>Una oficina digital cómoda. Utilizamos herramientas digitales modernas — Miro, Notion, Zoom, etc. — para que el trabajo conjunto sea fluido.</li> <li>Un equipo diverso y unido, distribuido entre EE.UU. y América Latina.</li> </ul> <ul> <li>Más de 2 años de experiencia trabajando como científico de datos.</li> <li>Experiencia trabajando como analista utilizando Python.</li> <li>Experiencia de más de un año trabajando en proyectos de aprendizaje automático (machine learning).</li> <li>Familiaridad con las librerías Pandas, NumPy, Matplotlib, Sklearn.</li> <li>Inglés intermedio, español nativo o avanzado.</li> </ul> <p class=""source"" data-source=""Spark Hire"" data-site=""www.sparkhire.com.ats.organic""> <a href=""/job/ec639bb87082ba43ad000b8ec201cceeae/eaa"" target=""_blank"" rel=""nofollow""> TripleTen <svg class=""icon""><use xlink:href=""#icon-external-light""></use></svg> </a> </p>",https://www.opcionempleo.ec/jobad/ec639bb87082ba43ad000b8ec201cceeae
41,UX/UI Semi Senior- Quito- Ecuador,Sofka Technologies,"Quito, Pichincha",,,Tiempo completo,Permanente,Hace 12 días,"¿Estás buscando nuevos desafíos y un lugar donde puedas disfrutar de un ambiente cercano mientras aprendes constantemente? ¡Bienvenido a un equipo con un propósito claro: ""TRANSFORMAR la vida de las personas siendo el aliado TECNOLÓGICO más confiable""! 🚀 ¡Prepárate y únete a esta aventura! ¿Qué encontrarás? <ul> <li>Retos técnicos y personales que te mantendrán en constante crecimiento.🤝 Un equipo conectado, enfocado en tu bienestar físico y mental.</li> <li>Cultura de mejora continua, fresca y colaborativa, con oportunidades de aprendizaje y gente dispuesta a apoyarte.</li> <li>KaizenHub, un programa diseñado para potenciar tus talentos, con feedback, mentorías y coaching a través de Sofka U. ¡Será un reto y un juego a la vez! 🧠🎮</li> <li>Programas como Happy Kaizen y WeSofka que cuidan tu bienestar físico y emocional.</li> </ul> ¿Qué buscamos? Buscamos un Diseñador UX/UI Semi Senior con experiencia en investigación de usuarios y diseño de interfaces digitales para productos de alto impacto. Serás parte de un equipo ágil y multidisciplinario, colaborando con desarrollo, QA y negocio para crear experiencias consistentes, seguras y centradas en las personas. Tu rol será clave para transformar necesidades en soluciones visuales y funcionales que generen valor. Si disfrutas entender al usuario, crear flujos intuitivos y mantener coherencia en cada interacción, esta oportunidad es para ti. Responsabilidades principales: <ul> <li>Diseñar flujos de usuario intuitivos y seguros en productos digitales.</li> <li>Crear prototipos y pruebas de usabilidad enfocados en la claridad, eficiencia y satisfacción del usuario.</li> <li>Garantizar la consistencia visual en todos los canales y productos.</li> <li>Colaborar estrechamente con los equipos de desarrollo, QA y producto.</li> <li>Liderar talleres de co-creación e ideación utilizando herramientas digitales (Miro, Mural).</li> <li>Aplicar metodologías de investigación UX (entrevistas, observación, pruebas A/B, heatmaps, eyetracking).</li> <li>Desarrollar y mantener sistemas de diseño y guías de estilo.</li> <li>Asegurar la accesibilidad y coherencia visual a través de herramientas como Storybook.</li> <li>Utilizar herramientas de feedback y analítica como Qualtrics, UXCam y Zendesk para mejorar la experiencia del usuario.</li> </ul> Conocimientos técnicos requeridos: <ul> <li>Experiencia: 3 a 4 años en roles de UX &amp; UI dentro de equipos de desarrollo o tecnología.</li> <li>Herramientas UX: Miro, Mural, Qualtrics, UXCam, Zendesk.</li> <li>Herramientas UI: Figma, Storybook, Design Systems, Adobe XD (deseable).</li> <li>Investigación y validación: Pruebas A/B, entrevistas, grupos focales, mapas de empatía, Customer Journey Maps, Service Blueprints.</li> <li>Diseño visual: Tipografía, color, iconografía, layout y accesibilidad.</li> <li>Metodologías ágiles: Experiencia trabajando en entornos colaborativos con Scrum/Kanban.</li> </ul> ¡PRESENTATE y sé parte de esta historia! Condiciones <ul> <li>Contrato a término indefinido ¡Queremos relaciones a largo plazo y que seas parte de nuestra familia por mucho tiempo!</li> <li>¿Buscas crecimiento profesional? En Sofka, te ofrecemos un ecosistema de aprendizaje con múltiples herramientas para cerrar brechas y potenciar tus habilidades. ¡Tú decides cómo quieres crecer! 📚</li> </ul> <p class=""source"" data-source=""Teamtailor"" data-site=""www.teamtailor.com.ats.organic""> <a href=""/job/ec7dbb5769aa97c2bc7deab130c8156114/eaa"" target=""_blank"" rel=""nofollow""> Sofka Technologies <svg class=""icon""><use xlink:href=""#icon-external-light""></use></svg> </a> </p>",https://www.opcionempleo.ec/jobad/ec7dbb5769aa97c2bc7deab130c8156114
42,"Arquitecto de Soluciones Senior Hibrido en Quito, Ecuador",Sofka Technologies,"Quito, Pichincha",,,Tiempo completo,Permanente,Hace 13 días,"¿Estás buscando nuevos desafíos y un lugar donde puedas disfrutar de un ambiente cercano mientras aprendes constantemente? ¡Bienvenido a un equipo con un propósito claro: ""TRANSFORMAR la vida de las personas siendo el aliado TECNOLÓGICO más confiable""! 🚀 ¡Prepárate y únete a esta aventura! ¿Qué encontrarás? <ul> <li>Retos técnicos y personales que te mantendrán en constante crecimiento.🤝 Un equipo conectado, enfocado en tu bienestar físico y mental.</li> <li>Cultura de mejora continua, fresca y colaborativa, con oportunidades de aprendizaje y gente dispuesta a apoyarte.</li> <li>KaizenHub, un programa diseñado para potenciar tus talentos, con feedback, mentorías y coaching a través de Sofka U. ¡Será un reto y un juego a la vez! 🧠🎮</li> <li>Programas como Happy Kaizen y WeSofka que cuidan tu bienestar físico y emocional.</li> </ul> ¿Qué buscamos? Buscamos a un(a) Arquitecto(a) de Soluciones Senior apasionado(a) por el diseño de sistemas escalables y de alto rendimiento. Si tienes un dominio comprobado de Clean Architecture, microservicios y DDD, y una amplia experiencia en la orquestación de contenedores y despliegues en la nube, eres la persona ideal para unirte a nuestro equipo. Buscamos a un líder técnico que no solo diseñe, sino que también guíe y alinee a los equipos para construir soluciones que transformen el mercado. Este rol es para ti si te emociona tomar decisiones técnicas de alto impacto, innovar con tecnologías de punta y colaborar estrechamente con equipos multifuncionales. Serás una pieza clave en la definición de la visión técnica y en la materialización de productos que resuelvan problemas reales para nuestros usuarios. Responsabilidades <ul> <li>Diseñar y definir la arquitectura de sistemas, asegurando su escalabilidad, seguridad y mantenibilidad.</li> <li>Liderar la implementación de patrones de diseño como DDD y CQRS.</li> <li>Coordinar la alineación técnica entre equipos de desarrollo, QA, operaciones y socios.</li> <li>Supervisar la infraestructura y el despliegue, utilizando herramientas como Kubernetes y pipelines de CI/CD.</li> <li>Definir e implementar estrategias de pruebas automatizadas con herramientas como Cypress y Appium.</li> <li>Guiar la elección y el uso de frameworks de desarrollo (NestJS, Angular, React Native).</li> <li>Asegurar la comunicación asíncrona y la resiliencia en sistemas distribuidos con herramientas como Kafka y RabbitMQ.</li> <li>Contribuir activamente en la visión de negocio, traduciendo requisitos en soluciones técnicas.</li> </ul> Requisitos <ul> <li>Formación: Título universitario en Ingeniería en Sistemas o carreras afines.</li> <li>Experiencia: Amplia experiencia en el diseño y la arquitectura de sistemas de software complejos.</li> </ul> Conocimientos Técnicos <ul> <li>Arquitectura y Diseño:</li> </ul> <ul> <li>Patrones de Arquitectura (Clean Architecture, Microservicios, DDD, CQRS).</li> <li>Infraestructura y Cloud:</li> </ul> <ul> <li>Orquestación de contenedores (Kubernetes).</li> <li>CI/CD y herramientas cloud (AWS).</li> <li>Frameworks y Lenguajes:</li> </ul> <ul> <li>NestJS, TypeScript, Angular, React Native.</li> <li>Sistemas Distribuidos:</li> </ul> <ul> <li>Kafka y RabbitMQ.</li> <li>Automatización y Testing:</li> </ul> <ul> <li>Cypress, Appium, y API Testing.</li> <li>Bases de Datos:</li> </ul> <ul> <li>Modelado y optimización en SQL y NoSQL.</li> <li>Herramientas de Colaboración:</li> </ul> <ul> <li>Jira y Confluence.</li> <li>Deseable:</li> </ul> <ul> <li>Experiencia con herramientas de experiencia de usuario como Qualtrics, UXCam o Zendesk.</li> </ul> 💡 Personas apasionadas, dispuestas a dar lo mejor de sí mismas. ¡PRESENTATE y sé parte de esta historia! Condiciones <ul> <li>Contrato a término indefinido ¡Queremos relaciones a largo plazo y que seas parte de nuestra familia por mucho tiempo!</li> <li>¿Buscas crecimiento profesional? En Sofka, te ofrecemos un ecosistema de aprendizaje con múltiples herramientas para cerrar brechas y potenciar tus habilidades. ¡Tú decides cómo quieres crecer! 📚</li> <li>Posición hibrida en Quito, Ecuador (3 días presencial y 2 días desde casa)</li> </ul> <p class=""source"" data-source=""Teamtailor"" data-site=""www.teamtailor.com.ats.organic""> <a href=""/job/ecfbcc9544279db6d809537bebf2089300/eaa"" target=""_blank"" rel=""nofollow""> Sofka Technologies <svg class=""icon""><use xlink:href=""#icon-external-light""></use></svg> </a> </p>",https://www.opcionempleo.ec/jobad/ecfbcc9544279db6d809537bebf2089300
43,ESPECIALISTA UX/UI GUAYAQUIL,Xtrim,"Guayaquil, Guayas",,,Tiempo completo,Permanente,Hace 30 días,"Funciones: Diseñar experiencias de usuario (UX) centradas en las necesidades y comportamientos de los usuarios. Optimizar flujos de navegación y procesos de autogestión en plataformas digitales (onboarding, pagos, consultas, autogestión, soporte en diferentes canales) Elaborar prototipos interactivos y pruebas de usabilidad, desde wireframes hasta prototipos navegables, validando con stakeholders. Colaborar con equipos de desarrollo, QA, producto y marketing para garantizar coherencia y efectividad en la experiencia. Aplicar principios de accesibilidad y buenas prácticas de diseño, manteniéndose actualizado en tendencias y herramientas de UX. Definir indicadores de desempeño, analizar métricas y liderar mejoras basadas en datos. Mantener y actualizar el Design System, velando por la coherencia multicanal. Asegurar accesibilidad y cumplimiento de normas y lineamientos corporativos. Facilitar talleres de ideación y priorización con distintas áreas del negocio. Requisitos Título de tercer nivel en Ingeniería en Sistemas, Informática, Software, Ciencias de la Computación, Comunicación Visual/Digital, Diseño Grafico o carreras afines. Experiencia comprobada mínima de 2 años en roles de UX/UI (research + diseño) con impacto en producto digital. Cursos relacionados a NN/g, HFI, Google UX, IxDA, Scrum/SAFe, Design Thinking, Lean UX, Discovery continuo, Research Ops, Métricas de producto, Accesibilidad WCAG 2.2, UX Writing, y/o Diseño conversacional. Experiencia en el diseño de interfaces web y móviles. Fuerte sentido estético y atención al detalle. Colaboración en células o metodologias ágiles. Capacidad para trabajar en equipo y adaptarse rápidamente a nuevas herramientas y técnicas. Buenas habilidades de comunicación y presentación. Herramientas Clave: Figma / Adobe XD / Sketch Miro / Lucidchart / Whimsical Hotjar / Google Analytics / Mixpanel Notion / Jira / Confluence Qualtrics / Typeform / SurveyMonkey Beneficios Salario acorde al mercado laboral. Beneficios de ley Seguro medico privado. Seguro de vida. <p class=""source"" data-source=""Hiring Room"" data-site=""www.hiringroom.com.ats.organic""> <a href=""/job/ec08ac395fc05d813d0c85b5e2e514e28f/eaa"" target=""_blank"" rel=""nofollow""> Xtrim <svg class=""icon""><use xlink:href=""#icon-external-light""></use></svg> </a> </p>",https://www.opcionempleo.ec/jobad/ec08ac395fc05d813d0c85b5e2e514e28f
44,Desarrollador Backend NestJS Semisenior,Sofka Technologies,"Quito, Pichincha",,,Tiempo completo,Permanente,Hace 1 mes,"✨ ¿Estás buscando nuevos desafíos y un lugar donde puedas disfrutar de un ambiente cercano mientras aprendes constantemente? ¡Bienvenido a un equipo con un propósito claro: ""TRANSFORMAR la vida de las personas siendo el aliado TECNOLÓGICO más confiable""! 🚀💡 ¡Prepárate y únete a esta aventura! 🎯 ¿Qué encontrarás? 🔧 Retos técnicos y personales que te mantendrán en constante crecimiento. 🤝 Un equipo conectado, enfocado en tu bienestar físico y mental. 🌱 Cultura de mejora continua, fresca y colaborativa, con oportunidades de aprendizaje y gente dispuesta a apoyarte. 🎓 KaizenHub, un programa diseñado para potenciar tus talentos, con feedback, mentorías y coaching a través de Sofka U. ¡Será un reto y un juego a la vez! 🧠🎮 🎉 Programas como Happy Kaizen y WeSofka que cuidan tu bienestar físico y emocional. ¿Qué buscamos? 💡 Un Desarrollador Backend Semi Senior apasionado por crear soluciones escalables y de alto rendimiento. Será responsable de diseñar, implementar y mantener servicios backend eficientes, colaborando estrechamente con equipos de frontend, QA y producto, y asegurando calidad técnica en cada entrega. Responsabilidades principales: <ul> <li>Diseñar, desarrollar y mantener servicios backend escalables usando NestJS + TypeScript.</li> <li>Implementar arquitecturas limpias y patrones como Clean Architecture, DDD y CQRS.</li> <li>Integrar y optimizar comunicación asíncrona con RabbitMQ o Kafka.</li> <li>Orquestar servicios con Kubernetes y asegurar disponibilidad en AWS.</li> <li>Realizar revisiones de código y aplicar estándares de calidad.</li> <li>Implementar reglas de inspección en pipelines CI/CD.</li> <li>Analizar y resolver problemas técnicos complejos, incluyendo desempeño y escalabilidad.</li> <li>Colaborar con el equipo para alinear las soluciones con la visión del producto y las necesidades del negocio.</li> </ul> Requisitos: <ul> <li>Formación: Ingeniero de sistemas o carreras afines.</li> <li>Experiencia: Más de 3 años como desarrollador Backend con dominio de NestJS + TypeScript.</li> <li>Conocimientos avanzados en Rest Services, microservicios y servicios web.</li> <li>Experiencia en AWS (CloudWatch u otros), Azure (deseable).</li> <li>Sólida base en Programación Orientada a Objetos y Programación Funcional.</li> <li>Dominio de conceptos como escalabilidad, resiliencia, disponibilidad y concurrencia.</li> </ul> Conocimientos técnicos prioritarios: <ul> <li>Frameworks: NestJS + TypeScript.</li> <li>Infraestructura y despliegue: Kubernetes, AWS.</li> <li>Mensajería: RabbitMQ, Kafka.</li> <li>Arquitectura: Clean Architecture, DDD, CQRS.</li> <li>Testing y calidad: Revisiones de código, pipelines CI/CD.</li> </ul> ¡PRESENTATE y sé parte de esta historia! 🎉 Condiciones 📝Contrato a término indefinido ¡Queremos relaciones a largo plazo y que seas parte de nuestra familia por mucho tiempo! 🚀 ¿Buscas crecimiento profesional? En Sofka, te ofrecemos un ecosistema de aprendizaje con múltiples herramientas para cerrar brechas y potenciar tus habilidades. ¡Tú decides cómo quieres crecer! 🌟📚 📍 Ubicación: Ecuador <p class=""source"" data-source=""Teamtailor"" data-site=""www.teamtailor.com.ats.organic""> <a href=""/job/ec6501466d64db116fda474b76c01b2308/eaa"" target=""_blank"" rel=""nofollow""> Sofka Technologies <svg class=""icon""><use xlink:href=""#icon-external-light""></use></svg> </a> </p>",https://www.opcionempleo.ec/jobad/ec6501466d64db116fda474b76c01b2308
45,Desarrollador Backend NestJS Senior,Sofka Technologies,"Quito, Pichincha",,,Tiempo completo,Permanente,Hace 2 meses,"✨ ¿Te apasiona crear servicios escalables y resilientes que impacten directamente en el usuario? En nuestro equipo encontrarás el espacio para crecer, retarte y compartir tu conocimiento 🚀 ¡Bienvenido a un equipo con un propósito claro: ""TRANSFORMAR la vida de las personas siendo el aliado TECNOLÓGICO más confiable""! 🚀💡 ¡Prepárate y únete a esta aventura! 🎯 ¿Qué encontrarás? 🔧 Retos técnicos y personales que te mantendrán en constante crecimiento. 🤝 Un equipo conectado, enfocado en tu bienestar físico y mental. 🌱 Cultura de mejora continua, fresca y colaborativa, con oportunidades de aprendizaje y gente dispuesta a apoyarte. 🎓 KaizenHub, un programa diseñado para potenciar tus talentos, con feedback, mentorías y coaching a través de Sofka U. ¡Será un reto y un juego a la vez! 🧠🎮 🎉 Programas como Happy Kaizen y WeSofka que cuidan tu bienestar físico y emocional. ¿Qué buscamos? 💡 Un Desarrollador Backend Senior con más de 4 años de experiencia en NestJS, capaz de liderar técnicamente el desarrollo de soluciones escalables y de alto rendimiento. Será responsable de diseñar, implementar y optimizar servicios backend complejos, además de guiar al equipo en buenas prácticas y estándares de calidad, trabajando estrechamente con frontend, QA y producto para garantizar resultados excepcionales. Responsabilidades principales: <ul> <li>Liderar el diseño y desarrollo de servicios backend escalables con NestJS + TypeScript.</li> <li>Definir e implementar arquitecturas limpias aplicando Clean Architecture, DDD y CQRS.</li> <li>Gestionar la orquestación de contenedores con Kubernetes y la infraestructura en AWS.</li> <li>Diseñar e integrar comunicación asíncrona con RabbitMQ o Kafka.</li> <li>Realizar revisiones de código, establecer estándares y asegurar su cumplimiento.</li> <li>Configurar y mantener reglas de inspección de código en pipelines CI/CD.</li> <li>Mentorizar y dar coaching a desarrolladores junior y semi senior.</li> <li>Impulsar mejores prácticas en el equipo y promover la calidad de los entregables.</li> <li>Participar activamente en discusiones técnicas y decisiones de arquitectura.</li> <li>Detectar y resolver problemas de desempeño y proponer soluciones innovadoras.</li> </ul> Requisitos: <ul> <li>Formación: Ingeniero de sistemas o carreras afines.</li> <li>Experiencia: Más de 4 años como desarrollador Backend, con amplia experiencia en NestJS + TypeScript.</li> <li>Experiencia comprobada en diseño de Rest Services, microservicios y servicios web.</li> <li>Dominio de AWS (CloudWatch, entre otros) y conocimientos en Azure.</li> <li>Experiencia sólida en Programación Orientada a Objetos y Programación Funcional.</li> <li>Conocimiento profundo en escalabilidad, resiliencia, disponibilidad y concurrencia.</li> </ul> Conocimientos técnicos prioritarios: <ul> <li>Frameworks: NestJS + TypeScript.</li> <li>Infraestructura y despliegue: Kubernetes, AWS.</li> <li>Mensajería: RabbitMQ, Kafka.</li> <li>Arquitectura: Clean Architecture, DDD, CQRS.</li> <li>Calidad y automatización: Revisiones de código, CI/CD, análisis y optimización de desempeño.</li> </ul> Condiciones 📝Contrato a término indefinido ¡Queremos relaciones a largo plazo y que crezcas con nosotros! 💡 🚀 ¿Buscas crecimiento profesional? En Sofka, te ofrecemos un ecosistema de aprendizaje con múltiples herramientas para cerrar brechas y potenciar tus habilidades. ¡Tú decides cómo quieres crecer! 🌟 📍 Ubicación: Remota. <p class=""source"" data-source=""Teamtailor"" data-site=""www.teamtailor.com.ats.organic""> <a href=""/job/ec5a34756d0b7b79dd6084548786ee4ef1/eaa"" target=""_blank"" rel=""nofollow""> Sofka Technologies <svg class=""icon""><use xlink:href=""#icon-external-light""></use></svg> </a> </p>",https://www.opcionempleo.ec/jobad/ec5a34756d0b7b79dd6084548786ee4ef1
46,Desarrollador Semi Senior,NOMINA360,"Cuenca, Azuay",$ 7,,Tiempo completo,Permanente,Hace 26 días,"OJO: Presencial en la Ciudad de Cuenca, Ecuador Rango de Salario inicial de $ 7 0 0 a $ 9 0 0. En Nómina 3 6 0, somos una plataforma SaaS líder en gestión de nómina y talento humano en Ecuador. Estamos buscando un/a Desarrollador/a Semi Senior que quiera crecer en un entorno dinámico, colaborativo y con retos técnicos de impacto. Este rol es clave dentro de nuestro equipo de producto: tendrás autonomía parcial, trabajarás en proyectos de complejidad intermedia y participarás activamente en la calidad y seguridad de nuestras soluciones. Responsabilidades Desarrollar funcionalidades y participar en el análisis técnico de requerimientos. Diseñar y ejecutar pruebas unitarias e integraciones básicas. Dar soporte técnico de mediana complejidad a usuarios internos y QA. Colaborar en code reviews, asegurando calidad, seguridad y buenas prácticas. Documentar cambios técnicos y funcionales de manera clara y constante. Realizar despliegues en ambientes de test/dev siguiendo SOPs establecidos. Guiar y revisar el trabajo de perfiles Juniors, apoyando su desarrollo. Contribuir en retrospectivas y propuestas de mejora continua. Requisitos Experiencia: 2 a 5 años en desarrollo de software. Formación: Ingeniería en Sistemas, Informática o afines (título requerido). Conocimientos técnicos intermedios en: (backend). (frontend). MongoDB (consultas complejas, modelado básico). GitHub (flujo por ramas, PRs, resolución de conflictos). Experiencia con metodologías ágiles (Kanban, Azure DevOps, Shortcut). Capacidad para trabajar en equipo, comunicar ideas con claridad y asumir responsabilidad sobre entregables. Valoramos experiencia previa en SaaS o sistemas de gestión empresarial. Lo que ofrecemos: Rango de Salario de $ 7 0 0 a $ 9 0 0 con oportunidades de crecimiento dentro de la empresa. Ser parte de una plataforma SaaS en crecimiento con clientes de alto impacto. Cultura de aprendizaje continuo, participación en decisiones técnicas y acompañamiento en tu carrera profesional. Ambiente colaborativo con foco en innovación, seguridad y calidad. Si te interesa crecer con nosotros y asumir nuevos retos, postula y sé parte de Nómina 3 6 0: Cumplimiento en la base, talento en el destino. <p class=""source"" data-source=""Multitrabajos"" data-site=""www.multitrabajos.com""> Multitrabajos </p>",https://www.opcionempleo.ec/jobad/ec61c789027d0d1e688e976f0cb488843e
