index,titulo,empresa,ubicacion,salario,modalidad,jornada,tipo_contrato,fecha_publicacion,descripcion,url
63,Sr. Campaign Developer,Instituto Superior Tecnológico Quito Metropolitano,Ecuador,,,Tiempo completo,Permanente,Hace 3 días,"Campaign Developer Digital Alchemy, A global Marketing Automation Services Provider, provides marketing services and technical support to local and global organizations. We have a network of 8 offices spanning Asia and the Americas. Our philosophy is based on the interaction of 3 transformations, 1. Our personal Transformation to learn and develop, 2. Transformation of the markets we operate in through our work, and 3. Transformation of the world that we live in through the development and support of sustainable enterprises that benefit under privileged communities and reduce the degradation of our environment. Digital Alchemy is an inclusive and diverse employer, we do not discriminate on any basis including gender, ethnicity, religious background, sexuality and any other factors, we actively recruit for a strong and diverse workforce."" As a Campaign Developer, you are accountable for the Client outcomes in terms of their strategic agenda and the delivery and execution of our Campaign design, briefing, optimisation and experimentation. You will plan, devise and help our Clients understand the best ways to design, build, QA and deploy marketing campaign capabilities based on their needs and business requirements. Key Responsibilities: <ul> <li>Ensuring best practice campaign design, build, QA &amp; execution on time and as per campaign brief.</li> <li>Influence and educate clients to make best practice decisions into campaign strategy and execution also consulting improvements that can be made to campaigns both new &amp; existing.</li> <li>Taking ownership of all communications between analytics, data, channel and other technical teams to ensure all the building blocks of a campaign are put together accurately, and on time.</li> <li>Work together with senior consultants in a consultative and strategic approach to deliver strategic solutions from campaign designing, briefing, optimisation and experimentation.</li> <li>Prioritise multiple tasks and document business requirement specifications on campaign management tools.</li> <li>Collaborate with internal and external stakeholders to gain a holistic understanding of clients and therefore be able to effectively present dynamic solutions.</li> <li>Work with senior consultants and the greater team to analyse client data, current campaigns and insights to identify opportunities and areas for additional projects to add value.</li> <li>Keep up to date on new technologies, industry trends and innovations to provide informed and relevant recommendation</li> </ul> Required Skills &amp; Experience <ul> <li>Bachelor's degree in Computer Science, Engineering, Business, or related field.</li> <li>2-3 years of experience working with end-to-end marketing campaigns in Marketing Automation platforms specially with SAS</li> <li>Experience operating SAS Marketing automation platforms</li> <li>Strong experience in handling stakeholder inquiries and providing solutions to stakeholder</li> <li>Strong Coding skills in SQL programming for database</li> <li>Strong understanding of A/B testing, experimentation methodologies, and performance reporting to optimize email marketing efforts.</li> <li>Strong background in database marketing, direct marketing and/or performance digital marketing</li> <li>Strong problem-solving, critical and creative thinking</li> <li>Desire to be a key part of a high-performance team</li> <li>Conversational English</li> </ul> Powered by JazzHR <p class=""source"" data-source=""JazzHR"" data-site=""www.jazzhr.com.ats.organic""> <a href=""/job/ec1c5a5a31938a0d9cf0b12ee4f0ca5145/eaa"" target=""_blank"" rel=""nofollow""> Digital Alchemy Limited <svg class=""icon""><use xlink:href=""#icon-external-light""></use></svg> </a> </p>",https://www.opcionempleo.ec/jobad/ec1c5a5a31938a0d9cf0b12ee4f0ca5145
64,BIA / Data Analytics Tutor,TripleTen,"Quito, Pichincha","$2,500",,Tiempo completo,Permanente,Hace 5 días,"About TripleTen is a service that empowers individuals, regardless of their prior experience, to embark on the exciting and challenging journey of mastering tech professions. Our bootcamps focus on training students in software engineering, data science, business intelligence analytics, and QA engineering in a feasible and accessible way, ultimately leading them to thrive in a new career. Our mission is to ensure that every student has the opportunity to successfully master a new profession, find their purpose, and become a valuable member of the tech industry. TripleTen is a remote first organization mirroring our students who complete our bootcamps in a remote environment 💡 Please note that after applying for this position, you will be required to complete a test assignment. Successfully completing this assignment will be the first step in the interview process. **These positions are based in the LATAM market*** ***Please Submit All Resumes In English*** Our Tutors, better known as Instructors at Tripleten, are the role models for the students studying on our program. They mentor students, help them with difficult concepts and assignments, teach them the skills necessary to be a great BIA professional. They guide students through the program and into their future careers, making sure all students get the most out of both regardless of their background. What you will do: As an Instructor you will be a core part of students’ educational process and will: <ul> <li>Host regular live Q&amp;A sessions to help students unblock and progress confidently</li> <li>Offer personalized support through 1:1 video calls to answer questions and guide assignments</li> <li>Occasionally respond to student questions via direct messages</li> <li>Lead live lessons on core program topics and industry-relevant skills</li> <li>Share your professional insights and best practices to support the learning community</li> <li>Review student projects and provide feedback based on program standards</li> <li>Write clear, actionable feedback to help students improve and meet expectations</li> <li>Support students in text by explaining concepts, troubleshooting code, and clarifying project or review questions</li> </ul> What we can offer you: Fixed monthly compensation: <ul> <li>3+ years of experience: $2,500–$3,000</li> <li>1 year of experience: $2,000</li> <li>1.5–2.8 years of experience: $2,000–$2,500</li> </ul> <ul> <li>Fully remote role with a consistent weekly schedule, 8-hour workdays, five days a week, scheduled between 10 AM and 2 AM ET (Monday through Sunday). Your exact working hours will be confirmed during the interview process.</li> <li>Free in-house training to help you grow as a skilled Instructor and role model - including communication style, soft skills, and student engagement techniques</li> <li>Opportunities to grow your visibility as a public expert in the field</li> <li>Cross-cultural collaboration and the chance to connect with passionate teammates who love what they do</li> </ul> We're excited to get to know you and work together ? What to expect from the hiring process: The hiring process includes a check of your technical knowledge and teaching skills - this may happen through a technical assignment or a live (technical) interview. While the usual steps include a screening, a technical evaluation, and a final conversation, the exact order may vary depending on the program. We’ll guide you through each step along the way. Schedule: <ul> <li>Option 1: Sunday-Thursday 18:00-2:00 EST</li> <li>Option 2: Tuesday-Saturday 18:00-2:00 EST</li> </ul> Location: We are specifically targeting candidates based in Latin America. Applicants residing in the U.S. are not eligible for this position. ﻿Disclosures <ul> <li>At this time we are unable to offer H1B sponsorship opportunities in the USA.</li> </ul> <ul> <li>This job description is not designed to contain a comprehensive listing of activities, duties, or responsibilities that are required. Nothing in this job description restricts management's right to assign or reassign duties and responsibilities at any time.</li> </ul> <ul> <li>TripleTen is an equal employment opportunity/affirmative action employer and considers qualified applicants for employment without regard to race, color, religion, sex, national original, age, religion, disability, marital status, sexual orientation, gender identity/expression, protected military/veteran status, or any other legally protected factor.</li> </ul> <ul> <li>3+ years of experience in Business analysis/Data Analysis in large-scale data sets, creating dashboards, reports and presentations with compelling visuals with BI-tools</li> <li>You can explain topics in Excel, SQL, statistics, mathematics, data visualization tools in a way that is understandable for students</li> <li>Advanced SQL skills, including ability to manipulate complex databases, create temporary views and functions</li> <li>Professional user of Tableau or Power-BI (ideally, being confident with both)</li> <li>2+ years of experience working in tech industry - experience with the U.S. market is a plus</li> <li>Availability for full-time collaboration (approximately 40 hours per week)</li> <li>A genuine passion for teaching, sharing knowledge, and staying up to date with the evolving field of Business Intelligence Analytics</li> </ul> Language &amp; Communication: <ul> <li>Excellent spoken and written English is required. The role involves leading live sessions, engaging with students, and delivering clear, confident communication.</li> </ul> We appreciate it if you have: <ul> <li>Teaching or tutoring experience;</li> <li>Experience with other BI-tools (Looker, QlikView, Grafana, Streamlit, Google Analytics, etc..)</li> <li>Programming experience in Python/R</li> <li>Experience with analytics pipelines, ETL processes using Python, Airflow, dbt and/or other similar data integrations/scheduling tools</li> <li>Have your own experience as a student online, and the desire to help create the best place in the world to study Business Intelligence Analysis</li> </ul> <p class=""source"" data-source=""Spark Hire"" data-site=""www.sparkhire.com.ats.organic""> <a href=""/job/ec0fa74d66d4e196df324eea61c36390db/eaa"" target=""_blank"" rel=""nofollow""> TripleTen <svg class=""icon""><use xlink:href=""#icon-external-light""></use></svg> </a> </p>",https://www.opcionempleo.ec/jobad/ec0fa74d66d4e196df324eea61c36390db
65,Head of Customer Support LATAM,TripleTen,"Quito, Pichincha",,,Tiempo completo,Permanente,Hace 5 días,"is an award-winning online school among technology bootcamps. Our mission is to help people change their lives and succeed in technology. We offer flexibility in studies, career mentoring, resume and portfolio preparation, and we guarantee employment after the course. Our employability rate among graduates is 87% across our Full Stack Development, Quality Assurance (QA) and Data Analytics. ﻿ We are looking for Customer Support Lead for team. The ideal candidate will have a strong operational mindset, an ability to inspire their team, excellent negotiation skills, and a proactive approach to problem-solving. Please submit all resumes or CV's in English. What you will do: 1. Leadership and Management: <ul> <li>Lead and manage a Customer Support Stream (client requests).</li> <li>Foster a culture of operational excellence, ownership, and continuous improvement within the team.</li> <li>Ensure the first touch with a client is of the highest quality, setting the tone for their entire journey.</li> <li>Drive a solution-oriented approach for every client issue, ensuring a quick and effective resolution.</li> </ul> 2. Operational Excellence: <ul> <li>Establish and refine best-practice processes, timelines, and procedures to ensure efficient operations.</li> <li>Monitor KPIs and performance metrics for each team, providing regular feedback and coaching.</li> <li>Implement operational checks to identify early signs of problems and respond proactively.</li> <li>Coordinate with other departments, ensuring smooth communication and collaboration, especially between sales, product, and support teams.</li> <li>Ensure the implementation of policies and procedures, providing instruction and support to promote compliance and best practices.</li> <li>Continuously evaluate and adjust workflows to adapt to the changing needs of the business and client expectations.</li> </ul> 3. Team Development: <ul> <li>Inspire and coach the team to excel, fostering open communication and a high-performance culture.</li> <li>Conduct performance reviews, mentor team members, and identify training needs.</li> <li>Lead recruitment efforts, ensuring that new hires fit the operational goals and culture of the department.</li> </ul> What we can offer you: <ul> <li>100% remote collaboration.</li> <li>Convenient schedule to manage LATAM team - Monday to Friday, 9 AM - 6 PM or 10 AM - 7 PM (GMT-3).</li> <li>Professional development in the international team.</li> <li>A comfortable digital office. We use modern digital tools — Slack, Notion, Zoom, Hubspot, HiBob — to make collaborating together seamless.</li> <li>Diverse and tight-knit team spread out across the US, LatAm, and more!</li> </ul> <ul> <li>Bachelor's degree in Operations, Business Management, IT, or a related field.</li> <li>3+ years of experience in customer support or operations management, with at least 2 years in a leadership role.</li> <li>Strong experience in handling client-facing teams, including customer support.</li> <li>Proven ability to manage and develop teams with a focus on performance improvement and motivation.</li> <li>Excellent operational skills, with a track record of setting up and optimizing procedures.</li> <li>Strong negotiation and conflict resolution skills, capable of de-escalating challenging situations with both clients and internal stakeholders.</li> <li>A proactive mindset, with strong analytical and problem-solving abilities.</li> <li>Experience with CRM and customer support tools (e.g., Hubspot).</li> <li>Fluency in English and Spanish.</li> </ul> <p class=""source"" data-source=""Spark Hire"" data-site=""www.sparkhire.com.ats.organic""> <a href=""/job/ec41773d584734c7ac965bbccce34f718e/eaa"" target=""_blank"" rel=""nofollow""> TripleTen <svg class=""icon""><use xlink:href=""#icon-external-light""></use></svg> </a> </p>",https://www.opcionempleo.ec/jobad/ec41773d584734c7ac965bbccce34f718e
66,Cybersecurity Instructor,TripleTen,"Quito, Pichincha","$2,300",,Tiempo completo,Permanente,Hace 6 días,"is a service that empowers individuals, regardless of their prior experience, to embark on the exciting and challenging journey of mastering tech professions. Our bootcamps focus on training students in software engineering, data science, business intelligence analytics, cybersecurity and QA engineering in a feasible and accessible way, ultimately leading them to thrive in a new career* Our mission is to ensure that every student has the opportunity to master a new profession successfully, find their purpose, and become a valuable member of the tech industry. TripleTen is a remote-first organization mirroring our students who complete our boot camps in a remote environment. Our Instructor are role models for the students studying in our cybersecurity program. They mentor students, help them with difficult concepts and assignments, and teach them the skills necessary to be great cybersecurity professionals. They guide students through the program and into their future careers, ensuring all students get the most out of both, regardless of their background. What you will do: <ul> <li>Host regular live Q&amp;A sessions to help students unblock and progress confidently</li> <li>Offer personalized support through 1:1 video calls to answer questions and guide assignments</li> <li>Occasionally respond to student questions via direct messages</li> <li>Lead live lessons on core program topics and industry-relevant skills</li> <li>Share your professional insights and best practices to support the learning community</li> <li>Review student projects and provide feedback based on program standards</li> <li>Write clear, actionable feedback to help students improve and meet expectations</li> <li>Support students in text by explaining concepts, troubleshooting code, and clarifying project or review questions</li> </ul> What we can offer you: <ul> <li>Fixed monthly compensation of $2,300-$3,000;</li> <li>Fully remote role with a consistent weekly schedule, 8-hour workdays, five days a week, scheduled between 10 AM and 7 pM ET (Monday through Friday). Your exact working hours will be confirmed during the interview process;</li> <li>Free in-house training to help you grow as a skilled expert tutor and role model - including communication style, soft skills, and student engagement techniques;</li> <li>Opportunities to grow your visibility as a public expert in the field;</li> <li>Cross-cultural collaboration and the chance to connect with passionate teammates who love what they do.</li> </ul> We're excited to get to know you and work together . Disclosures <ul> <li>At this time we are unable to offer H1B sponsorship opportunities in the USA.</li> <li>This job description is not designed to contain a comprehensive listing of activities, duties, or responsibilities that are required. Nothing in this job description restricts management's right to assign or reassign duties and responsibilities at any time.</li> <li>TripleTen is an equal employment opportunity/affirmative action employer and considers qualified applicants for employment without regard to race, color, religion, sex, national original, age, religion, disability, marital status, sexual orientation, gender identity/expression, protected military/veteran status, or any other legally protected factor.</li> </ul> <ul> <li>You have 3+ years of experience in the cybersecurity field. Experience with tools such as Nmap, Wireshark, Metasploit, Burp Suite, Splunk, ELK, and more. Familiarity with virtualization (VMware, Oracle VirtualBox) and cloud technologies.</li> <li>Familiarity with cloud security tools like CrowdStrike, Cisco SecureX, Prisma Cloud, and more.</li> <li>Experience in incident response and crisis management within a business environment.</li> <li>You have 3+ years of experience working in tech industry (experience with the U.S. market is a plus) and have been exposed to cybersecurity standards, such as NIST, ISO, and other regulatory frameworks.</li> <li>Availability for full-time collaboration (approximately 40 hours per week)</li> <li>A genuine passion for teaching, sharing knowledge, and staying up to date with the evolving field of Cybersecurity</li> <li>Fluent English: this role involves speaking directly with English-speaking students, so strong spoken communication is essential</li> </ul> We appreciate it if you have: <ul> <li>Teaching or tutoring experience</li> <li>Have your own experience as a student online, and the desire to help create the best place in the world to study Cybersecurity</li> </ul> <p class=""source"" data-source=""Spark Hire"" data-site=""www.sparkhire.com.ats.organic""> <a href=""/job/ec3b5321afd5c50d51fd908a684e9468f8/eaa"" target=""_blank"" rel=""nofollow""> TripleTen <svg class=""icon""><use xlink:href=""#icon-external-light""></use></svg> </a> </p>",https://www.opcionempleo.ec/jobad/ec3b5321afd5c50d51fd908a684e9468f8
67,Project Manager / Business Analyst,ioet,Ecuador,,,Tiempo completo,Permanente,Hace 4 días,"At ioet, a leading software company with a talented team across LATAM, we provide Software Engineering as a service to clients worldwide. Join us for exciting professional challenges, working on projects ranging from innovative startups to globally recognized brands. Our positions are full-time, remote, and offer competitive compensation in USD. We are looking for an experienced Project Manager / Business Analyst with hands-on experience in content management and QA. You will play a key role in coordinating cross-functional teams, managing CMS-related workflows, and ensuring seamless content delivery across web and mobile platforms. In this role, you'll collaborate closely with marketing, branding, product, and engineering stakeholders to gather requirements, prioritize tasks, and ensure the successful execution of content updates and technical improvements. You'll also support testing and QA for new CMS features, track issues, and create actionable JIRA tickets for development and product teams. Requirements: <ul> <li>2-3 years of experience in Project Management, Business Analysis, or Content Operations.</li> </ul> <ul> <li>Experience working with CMS platforms and managing digital content workflows.</li> </ul> <ul> <li>Familiarity with QA and testing processes for web or mobile applications.</li> </ul> <ul> <li>Experience creating and maintaining JIRA tickets or similar project tracking tools.</li> <li>Strong attention to detail and high level of proactivity.</li> </ul> <ul> <li>Strong analytical and organizational skills with the ability to manage multiple priorities.</li> </ul> <ul> <li>Comfortable working independently and across diverse teams.</li> </ul> <ul> <li>Excellent communication and stakeholder management abilities</li> <li>Strong English communication skills - Minimum B2 level proficiency</li> <li>Send your application and CV in English (mandatory)</li> <li>Based in Latin America</li> </ul> Nice to Have: Background in content marketing or editorial workflows Basic understanding of software development. Benefits: <ul> <li>Remote work</li> <li>Flexible schedule</li> <li>Collaboration with international clients</li> <li>USD compensation</li> <li>Paid Holidays and Vacations</li> <li>Paid family and sick leaves</li> <li>English classes</li> <li>Educational and wellness bonus</li> <li>Structured career plan with regular salary reviews</li> <li>Emphasis on personal growth and mentorship</li> </ul> Are you ready to be part of the ioet journey? Get your CV in English and Apply Now. If you are curious to know more about our culture, technologies, and blogs, visit <p class=""source"" data-source=""ioet"" data-site=""www.ioet.com""> <a href=""/job/ec8270f268be5686faef858cdc526cbdcf/eaa"" target=""_blank"" rel=""nofollow""> ioet <svg class=""icon""><use xlink:href=""#icon-external-light""></use></svg> </a> </p>",https://www.opcionempleo.ec/jobad/ec8270f268be5686faef858cdc526cbdcf
