index,titulo,empresa,ubicacion,salario,tipo_contrato,modalidad,descripcion,url
15,Analista de Tecnica Aduanera - job post,DHL,"Guayaquil, Provincia del Guayas",,,,"En DHL Express, nuestro propósito es “Conectar a las personas, mejorar vidas”. Somos la empresa más internacional del mundo, ""la gran máquina amarilla"", como nos encanta llamarla. Específicamente en nuestra región de América Central y del Sur, cubrimos 15 países, desde el Parque Nacional Tikal en Guatemala, hasta Ushuaia en Tierra del Fuego - Argentina. Somos más de 3.400 Especialistas Internacionales Certificados que trabajamos apasionadamente y motivados COMO UN SOLO equipo, moviendo más de 10 millones de envíos al año y superando las necesidades de nuestros clientes, mientras apoyamos sus negocios e impactamos positivamente en nuestras comunidades al mismo tiempo. Somos el Great Place to Work # 1 en América Latina y nos sentimos muy orgullosos de eso. ¡Y tenemos buenas noticias! ... Estamos buscando una Superestrella como tú, centrado en nuestros clientes y que quiera tener el mejor día, todos los días ... Propósito del Rol Es responsable de mantener los tiempos de nacionalización del material Inbound tanto en pre arribo como en arribo bajo los parámetros establecidos según procedimiento de la compañía. Principales Responsabilidades Ingreso de información de las guías a nuestros sistemas, asignación de régimen, categorización de las guías Courier, clasificación arancelaria y liquidación de impuestos. Ponerse en contacto con el cliente para obtener su información personal (datos necesarios para la declaración aduanera), confirmar contenido, uso y función de la carga y datos necesarios; notificar las guías clareadas antes del arribo y al mismo tiempo lograr su aprobación pre-autorizándola para su inmediato refrendo. Envío de notificación escrita (entrega con Courier) en caso de guías que no registren información o apertura de casos con Customer Service. Seguimiento de casos simplificados como es la categoría A (documentos y valija diplomática) realizando una correcta salida dentro del marco legal. Notificar a Billing las facturas generadas por reembarques. Enviar solicitudes de Notas de crédito al área de billing por cambios generados. La atención a llamadas telefónicas debe ser ágil y oportuna en el menor tiempo establecido. Canalizar los pagos de liquidaciones con cada Importador para no generar pagos de intereses correspondientes. Requisitos Estudios superiores culminados en Comercio Exterior. Nivel Intermedio – Avanzado Inglés Nivel IntermedioMicrosoft Office Muy buen nivel de servicio al cliente Administración del Tiempo Agilidad en manejo de procesos Conocimiento en procesos aduaneros y nomenclatura arancelaria. Manejo de reclamos 2 a 3 años de Experiencia en áreas como Comercio Exterior, Procesos Aduaneros o aranceles.",https://ec.indeed.com/jobs?q=analista+de+datos&l=Ecuador&radius=25&from=searchOnDesktopSerp%2Cwhereautocomplete&start=10&vjk=8e06a3d7aff77011
16,ANALISTA DE PLANIFICACIÓN DE VENTA Y FACTURACIÓN - job post,ChevyPlan,"Guayaquil, Provincia del Guayas",,Contrato,Remoto,"Si quieres empezar un nuevo reto como ANALISTA DE PLANIFICACIÓN DE VENTA Y FACTURACIÓN en la ciudad de GUAYAQUIL O QUITO y en una empresa donde podrás seguir creciendo y desarrollándote, de la mano de un equipo ganador. ¡Esta oferta te va a interesar! En ChevyPlan ayudamos a personas que desean un auto, a encontrar las herramientas adaptadas a su capacidad de pago, para que puedan adquirirlo y ahorrar en la compra de su vehículo Chevrolet Nuevo. En estos momentos, tenemos la oportunidad de incorporar, en nuestra área Comercial, a un/a ANALISTA DE PLANIFICACIÓN DE VENTA Y FACTURACIÓN que va a gestionar la información de ventas y facturación, asegurando su calidad, actualización y visualización efectiva. El aporte de esta posición es de suma importancia para nuestro giro de negocio. ¿Cómo es trabajar en ChevyPlan? “En ChevyPlan seleccionamos talentos basándonos en la evaluación de tus competencias” Nuestro proceso de selección se basa en capacidad y mérito, sin distinción de género, etnia, edad, orientación sexual u otra característica personal. Fomentamos un entorno de respeto y libre de discriminación con procesos transparentes e inclusivos. En esta compañía tendrás: Independencia: Vas a poder organizar tu día, tus visitas con los equipos, el monitoreo de indicadores y todas tus reuniones de acuerdo a tu planificación. Nos ayudamos entre compañeros: Serás parte de un equipo que se da la mano en las buenas y las malas, para la consecución de tus objetivos. Estabilidad y Seguridad: Si te esfuerzas por cumplir tus objetivos, vas a tener toda la estabilidad y seguridad que necesitas. SIEMPRE realizamos el pago puntual de tu sueldo y comisiones para que puedas planificarte, estar tranquilo/a y seguro/a, además de contar con TODOS los beneficios de ley y corporativos. Vas a ser reconocido y premiado: Si superas los objetivos, serás reconocido/a en las premiaciones semestrales y anuales, donde reconocemos con interesantes incentivos a nuestros colaboradores destacados. Vas a ser parte de una empresa Ética y Responsable: Somos parte de General Motors y la red de concesionarios Chevrolet, lo que te dará un gran respaldo y seguridad al generar relaciones de confianza y credibilidad con tus clientes, además serás parte del crecimiento de la marca. Tendrás Apoyo y Formación: Vas a estar constantemente apoyado por la compañía para poder conseguir los objetivos. ¿Qué te hará triunfar en el puesto? Para que te sientas bien en la posición, lo ideal es que tengas, al menos mínimo 2 años de experiencia en gestión de análisis de datos o inteligencia comercial, en industria automotriz, financiera o telecomunicaciones. Experiencia en manejo de facturación y procesos de ventas. En otras industrias: Analista de Sistemática Comercial y Facturación En ChevyPlan, el colaborador siempre está en el centro, por lo que si disfrutas con la atención personalizada y con el trato con tus áreas usuarias, ¡lo harás genial! ¿QUÉ TE OFRECEMOS PARA ESTA POSICIÓN? Contrato indefinido con período de prueba Modalidad de trabajo Híbrida Remuneración acorde al mercado Plan celular corporativo. Seguro de vida y salud privados Utilidades Premiaciones semestrales y anuales por desempeño. Después del segundo año en la compañía, 3 semanas íntegras de vacaciones (es decir, tus vacaciones no cuentan fines de semana). Descuentos en compra de nuestros planes de ChevyPlan con 75% de descuento en Cuota de Inscripción para el colaborador y un % de descuento en la facturación final de tu Chevrolet Nuevo, además de un 50% descuento en Cuota de Inscripción para familiares. Acceso voluntario y con descuentos preferenciales para colaboradores ChevyPlan en Seguro Dental, Seguro vehicular. NUESTRO PROPÓSITO: ""En ChevyPlan impactamos positivamente la calidad de vida de nuestros clientes, mediante el ahorro en la compra programada de su vehículo."" ¿Quieres ser quien haga realidad el sueño de tus clientes de tener su Chevrolet Nuevo? ¡Inscríbete en esta oferta y te contaremos todos los detalles! Recuerda dejarnos tu CV en formato PDF Departamento Comercial Ubicaciones Guayaquil, Quito Estado remoto Híbrido",https://ec.indeed.com/jobs?q=analista+de+datos&l=Ecuador&radius=25&from=searchOnDesktopSerp%2Cwhereautocomplete&start=10&vjk=4f244cffe822d30c
17,Analista de Business Intelligence - job post,Veolia,"Guayaquil, Provincia del Guayas",,Contrato,,"Descripción de la empresa La ambición de Veolia es convertirse en la empresa de referencia para la transformación ecológica. Con casi 218,000 empleados en cinco continentes, y más de 23.000 en Latam, el Grupo diseña y despliega soluciones útiles y prácticas para la gestión del agua, residuos y energía que ayudan a cambiar radicalmente el panorama mundial. En Veolia América Latina nos enfocamos en acompañar a nuestros clientes en el cumplimiento de sus objetivos de descarbonización, mediante soluciones ambientales innovadoras que optimizan sus procesos y reducen el impacto ambiental; trabajamos de la mano con ciudades e industrias para impulsar la descontaminación y crear entornos más limpios y saludables, mientras contribuimos al cuidado del planeta a través de la regeneración de recursos naturales con un modelo de economía circular que construye un futuro sostenible para todos. Descripción del empleo Posición clave para la ejecución del roadmap estratégico para la evolución de Salesforce en LATAM, impulsando la integración de funcionalidades avanzadas y optimización de procesos basados en IA para alcanzar el nivel 5 de madurez en nuestro CRM. La posición tiene como objetivo apoyar a la Dirección de Desarrollo de la región LATAM en la transformación de datos en insights valiosos que agreguen valor al equipo. Este puesto requiere colaborar estrechamente con los diversos miembros del equipo de desarrollo regional, así como con los equipos locales de los 9 países que conforman Veolia LATAM. Responsabilidades principales: Análisis de datos (50%) Definir, monitorear y optimizar KPIs comerciales críticos, utilizando los datos de Salesforce para identificar patrones de compra, analizar tendencias y formular estrategias que impulsen el crecimiento del negocio y la estabilidad en la región LATAM. Soporte en el reporte de clientes potenciales: análisis de mercado y colección de la información pública sobre los objetivos ambientales del cliente, elaboración de plantillas para presentaciones a clientes y ofertas comerciales Analizar grandes volúmenes de datos para obtener insights accionables que impulsen el desarrollo del negocio. Extracción, Transformación y Carga (ETL): Extraer datos de diversas fuentes (bases de datos SQL, archivos CSV, APIs, etc.), transformarlos para que sean consistentes y útiles, y cargarlos en un sistema de almacenamiento de datos (data warehouse, data lake, etc.) Colaborar con equipos multifuncionales para integrar datos analíticos en el proceso de toma de decisiones. Construir y mantener modelos de datos para pronósticos y proyecciones estadísticas. Desarrollar y ejecutar estrategias de analítica de mercados para identificar oportunidades comerciales. Análisis de información de las oportunidades en Salesforce como por ejemplo su desempeño, las tendencias y su alineación a Green Up. Modelado de Datos: Construir modelos estadísticos y de machine learning para predecir resultados, clasificar datos o segmentar clientes. Automatización de Procesos: Desarrollar scripts y flujos de trabajo automatizados para realizar tareas repetitivas de análisis de datos y generación de informes. Gestión de CRM Salesforce (25%) Seguimiento de la actividad comercial de los países a través del CRM Salesforce. Incluido el seguimiento específico a los proyectos presentados en el presupuesto de cada país. Seguimiento a las necesidades de licencias y gestión de las mismas Ejecución del roadmap de maduración e integraciones con otras herramientas Gestión de permisos y licencias para el acceso al programa de Sales Academy Requisitos Formación profesional Ingeniería en sistemas / Administración de negocios / Estadística Conocimiento de data analytics / científico de datos. Deseable: Conocimiento en temas comerciales Experiencia 3-4 años de experiencia en puestos similares, comprobada en análisis de datos, modelado de datos y desarrollo de proyecciones estadísticas Experiencia en analítica de mercados es una ventaja. Idiomas Español (fluido), Ingles (fluido). Es un plus saber de Francés, Portugués Manejo de CRM Salesforce Manejo de herramienta como usuario intermedio - avanzado Conocimiento de la industria en Latam & de la actividad de Veolia Entendimiento básico de las funciones comerciales de un negocio de servicios. Modelos predictivos e IA Experiencia comprobada en la implementación y gestión de soluciones de inteligencia artificial y aprendizaje automático (ej. Einstein Analytics, modelos predictivos) para la optimización de ventas y segmentación de clientes.optimización de ventas y segmentación de clientes. Información adicional Trabajará para la zona Latam, pero puede estar basado en Colombia/Chile/Argentina/Ecuador/Brazil As an inclusive company, Veolia is committed to diversity and gives equal consideration to all applications, without discrimination.",https://ec.indeed.com/jobs?q=analista+de+datos&l=Ecuador&radius=25&from=searchOnDesktopSerp%2Cwhereautocomplete&start=10&vjk=32610f2f8051527b
18,ANALISTA PROGRAMACION DE LA PRODUCCION - job post,Sigma Alimentos,Provincia de Pichincha,,,,"SIGMA está comprometida a promover el desarrollo del talento. Objetivo del Puesto Apoyar en la coordinación y ejecución del programa de producción, asegurando trazabilidad en sistemas, control de inventarios, generación de reportes, cumplimiento de estándares de calidad, seguridad e inocuidad, y liderando acciones de mejora continua que garanticen la disponibilidad del producto terminado conforme a lo planificado. Responsabilidades del Puesto Apoyar en la aplicación de la metodología 5'S en la planta, participando activamente en mantener los estándares del sistema. Revisar los registros de entrega/recepción de todos los documentos que se generan en el proceso productivo. Revisar las existencias de la bodega para realizar el pedido que garantice el stock necesario. Informar al supervisor de area sobre desviaciones encontradas al momento de ingresar ordenes de producción, monitero de ordenes y costos, a fin de que el supervisor tome las acciones necesarias para erradicar dicha desviación. Contribuir a la calidad e inocuidad de los productos y procesos, cumpliendo las buenas practicas de manufactura, para evitar desviaciones microbiológicas, químicas y físicas, que pudieran atentar contra la salud de los consumidores. Controlar y verificar inventarios de piso de acuerdo a stock que permitan organizar la producción. Apoyar al Supervisor en la revisión de la información ingresada en SAP, que permita una trazabilidad en tiempo y forma correcta. Liderar y hacer seguimiento del cumplimiento del programa de 5'S en el área de Operaciones. Asegurar y reportar el cumplimiento del programa de producción acorde a lo planificado. Entre otros. Requisitos Educación: Título de Tercer Nivel en Ing. Industrial / Alimentaria o afines. Conocimientos Normas de inocuidad alimentaria HACCP / BPM. Gestión de procesos productivos Sistemas ERP - SAP Análisis de Datos. Competencias Gestión del tiempo y prioridades Resolución de Problemas Pensamiento Crítico Comunicación Efectiva Trabajo en Equipo Orientación a Resultados Adaptabilidad y aprendizaje continuo Condiciones de Trabajo Disponibilidad Inmediata. Disponibilidad de trabajar en Sangolquí - Valle de los Chillos Contar con Movilización Propia (Auto) / Papeles al día En el caso de candidatos internos considerar lo siguiente: Estabilidad: Tener máximo 1 año de estabilidad en la compañía de preferencia en áreas de producción. En Sigma promovemos la originalidad. Reconocemos y celebramos el valor único de las personas, fomentando la igualdad de oportunidades sin discriminar por afiliación política, cultura, edad, embarazo, estado civil, género, nacionalidad, nivel socioeconómico, maternidad, paternidad, religión, orientación sexual, origen étnico o tipo de discapacidad. ¡Únete a nuestra comunidad de más de 60 nacionalidades en 4 continentes!",https://ec.indeed.com/jobs?q=analista+de+datos&l=Ecuador&radius=25&from=searchOnDesktopSerp%2Cwhereautocomplete&start=10&vjk=5bae04cad96b150d
19,Analista de Ejecución Comercial - job post,BIC,"Guayaquil, Provincia del Guayas",,,,"Durante más de 75 años, BIC ha estado creando productos ingeniosamente simples y alegres que forman parte de cada corazón y hogar. Como miembro de nuestro equipo, formarás parte del renacimiento de una marca muy querida a medida que continuamos re imaginando lo esencial de cada día de formas nuevas, sostenibles y responsables. Nuestro enfoque de trabajo de ""arremangarse y hacer el trabajo"" crea un entorno en el que prosperan los emprendedores, los solucionadores de problemas y los pensadores innovadores. Los miembros del equipo BIC están capacitados para asumir la propiedad de sus carreras y aportar sus perspectivas únicas a la mesa para hacer un impacto significativo en nuestra misión. Es un mundo colorido - deja tu huella uniéndote al equipo BIC hoy mismo. Job Description Como Execution Analyst en BIC Ecuador, serás responsable de asegurar la excelencia en la ejecución comercial en el punto de venta, alineada con la estrategia corporativa. Tu rol será clave para garantizar la correcta implementación de iniciativas, visibilidad de marca, activaciones y seguimiento de indicadores operativos, trabajando en estrecha colaboración con equipos internos y externos. Main Responsibilities Dirigir y asegurar la ejecución en punto de venta conforme a la estrategia corporativa. Monitorear el sell-out de distribuidores y proponer acciones para acelerar la rotación. Coordinar exhibiciones adicionales, visibilidad, precios y planogramas en PDV. Capacitar al equipo externo en productos, técnicas de merchandising y competencia. Medir e integrar indicadores operativos como agotados, precios y novedades. Supervisar el uso de material promocional y mantenimiento de activos. Controlar el presupuesto de materiales POP junto con el operador logístico. Generar órdenes de compra (O/R) para materiales y autoconsumos. Liderar licitaciones de materiales de Trade Marketing. Asegurar canales de comunicación abiertos para identificar oportunidades. Projects You'll Work On Ejecución de ferias y eventos con distribuidores. Implementación de estrategias de visibilidad en PDV. Desarrollo de reportes de gestión comercial para equipos internos. Coordinación de entregas oportunas y seguimiento de compromisos con clientes. Mejora continua de procesos de ejecución y comunicación comercial. Apoyo en iniciativas regionales de ejecución si se requiere. Qualifications Formación Académica: Universidad completa en Administración, Ingeniería Comercial, Marketing o carreras afines. Experiencia: Mínimo 2 años en posiciones similares. Conocimiento en productos de consumo masivo y manejo de canales de distribución (moderno, tradicional, papelero). Experiencia en ejecución comercial y coordinación con distribuidores. Habilidades y Competencias: Capacidad de análisis y toma de decisiones. Proactividad, iniciativa y trabajo bajo presión. Comunicación efectiva y manejo de relaciones interpersonales. Planificación, organización y orientación a resultados. Disponibilidad para viajar. Idiomas: Inglés intermedio. Herramientas: Excel avanzado, análisis de datos, reportes operativos. BIC es una empresa que ofrece igualdad de oportunidades. Nos comprometemos firmemente a contratar a personas con diferentes antecedentes y experiencias para ayudarnos a construir mejores productos, tomar mejores decisiones y servir mejor a nuestros clientes. No discriminamos por motivos de raza, religión, color, nacionalidad, sexo, orientación sexual, condición de veterano, discapacidad o características similares. Todos los empleos se deciden en función de las cualificaciones, los méritos y las necesidades de la empresa. BIC no busca ayuda ni acepta currículos no solicitados de empresas consultoras para esta oportunidad de empleo. Independientemente de la práctica anterior, todos los currículos presentados por las empresas consultoras a cualquier miembro del equipo de BIC a través de correo electrónico, o directamente a un miembro del equipo de BIC en cualquier forma sin un acuerdo de búsqueda válida por escrito en su lugar para esa posición se considerará propiedad exclusiva de BIC, y no se pagará ninguna cuota en el caso de que el candidato sea contratado por BIC como resultado de la remisión o por otros medios.",https://ec.indeed.com/jobs?q=analista+de+datos&l=Ecuador&radius=25&from=searchOnDesktopSerp%2Cwhereautocomplete&start=10&vjk=f9f18c0feff1084a
20,Analista de Control Contable - job post,Advising & Recruiting,"Quito, Provincia de Pichincha",,Contrato,,"OBJETIVO DEL CARGO Asegurar la efectividad de los controles internos en los procesos claves de la administración de cartera, mediante la ejecución de pruebas de control, conciliaciones contables y operativas, e identificación de riesgos para garantizar el cumplimiento normativo, la integridad de la información y la eficiencia operativa. DESCRIPCIÓN RESPONSABILIDADES GENERALES Diseño y monitoreo de controles Evaluar el diseño e implementación de controles en los procesos críticos en la administración de cartera Proponer mejoras en los controles existentes para mitigar riesgos operativos. Asesoría técnica y diseño Planificar y ejecutar pruebas periódicas de efectividad de controles (revisiones de muestras, documentación de respaldo, seguimiento de políticas). Documentar hallazgos encontrados. Conciliaciones Realizar conciliaciones bancarias Realizar pruebas departamentales validando materialidad y razonabilidad Realizar pago de seguros Validación previa de pago de proveedores externo de administración de cartera Informes y reportes Identificar errores, omisiones, duplicidades u operaciones inusuales. Preparar informes de control interno con hallazgos, y alertas. Proponer mejoras a los procesos FORMACIÓN ACADÉMICA Profesional en Ingeniera en Finanzas, contabilidad, auditoria, administración o carreras afines. REQUERIMIENTOS PROFESIONALES Mínimo 3 años de experiencia en control interno, auditoría o áreas de riesgos en instituciones financieras o empresas de créditos. Conocimientos sólidos en contabilidad bancaria. Experiencia en manejo de herramientas para conciliaciones y análisis de datos, incluyendo Excel avanzado y Power BI. Conocimiento en elaboración y seguimiento de matrices de riesgo. Experiencia con normas de control interno, especialmente COSO. Nivel de inglés básico COMPETENCIAS PERSONALES Orientación al logro Comunicación asertiva Pensamiento analítico Orientación al orden Enfoque en la calidad y el cumplimiento de estándares BENEFICIOS Seguro médico y de vida con 100% de cobertura. Medio día libre valido en el mes de cumpleaños. Pago de utilidades. TIPO DE CONTRATO Dependencia, Directo con la compañía. HORARIO LABORAL Lunes a Viernes 9:00a.m - 18:00 p.m.",https://ec.indeed.com/jobs?q=analista+de+datos&l=Ecuador&radius=25&from=searchOnDesktopSerp%2Cwhereautocomplete&start=10&vjk=d5e70920cdbab8fb
21,Analista de bodega - job post,Sedemi,Provincia de Pichincha,,Contrato,,"Te apasiona la logística, el control de inventarios y el análisis de datos? ¡Esta es tu oportunidad para unirte a SEDEMI y formar parte de una empresa líder en servicios industriales! ¡Es tu oportunidad de marcar la diferencia! Empresa Constructora dedicada a brindar soluciones a la medida para proyectos de infraestructura con enfoque en una cultura de servicio y generación de valor para nuestros stakeholders. Somos SEDEMI Construye el cambio Requisitos Formación: Título de tercer nivel en: Administración de Empresas, Ingeniería Industrial, Logística. Experiencia: De 1 a 2 años en cargos similares, con experiencia en: Análisis de niveles de inventario Indicadores de rotación Reaprovisionamiento de materiales Control de stocks mínimos y máximos Conocimientos: Demand & Supply Planning Gestión de inventarios Excel (intermedio) Power BI y R Studio (deseable) Herramientas de mejora continua Análisis estadístico Conocimientos en el uso de ERP Infor LN Beneficios Remuneración fija Afiliación al IESS Alimentación + Parqueadero",https://ec.indeed.com/jobs?q=analista+de+datos&l=Ecuador&radius=25&from=searchOnDesktopSerp%2Cwhereautocomplete&start=10&vjk=25b8bc0fd44eeeda
