index,titulo,empresa,ubicacion,salario,tipo_contrato,modalidad,descripcion,url
8,Tutor de Análisis de Datos LATAM - job post,TripleTen,Desde casa,,Tiempo parcial,Remoto,"TripleTen es el bootcamp #1 en EE. UU. y LATAM que empodera a las personas, sin importar su experiencia previa, para embarcarse en el emocionante y desafiante camino de dominar profesiones tecnológicas. Nuestros bootcamps se enfocan en capacitar a los estudiantes en ingeniería de software, ciencia de datos, analítica de inteligencia de negocios y QA engineering de una manera accesible y viable, llevándolos finalmente a prosperar en una nueva carrera. Nuestra misión es garantizar que cada estudiante tenga la oportunidad de dominar con éxito una nueva profesión, encontrar su propósito y convertirse en un miembro valioso de la industria tecnológica. Ten en cuenta que, después de postularte para este puesto, deberás completar una tarea de prueba tras tu llamada introductoria en línea. Estamos buscando Tutores de Análisis de Datos con experiencia y ganas de acompañar a estudiantes en su proceso de aprendizaje. Este rol requiere conocimientos sólidos en análisis de datos, habilidades de comunicación claras y empatía para resolver dudas y mantener a los estudiantes motivados. ¿Te gustaría transformar vidas a través de la educación y la tecnología? Requirements: +3 años de experiencia trabajando como analista de datos. Conocimiento de Python a nivel profesional resolviendo problemas de negocio (idealmente con al menos 3 años de experiencia). +1 año de experiencia trabajando con SQL en problemas reales, visualizaciones, estadística y probabilidad, y Excel. Experiencia con bibliotecas de Data Wrangling como Pandas, NumPy, Matplotlib, etc. Disponibilidad de al menos 16-20 horas semanales para dedicar a tus estudiantes. Inglés intermedio, español avanzado. What you will do: Liderarás un grupo de estudiantes en nuestro programa de Análisis de Datos, compartiendo tu experiencia e inspirándolos con tus conocimientos de la industria. Los ayudarás respondiendo sus preguntas y dándoles consejos prácticos de las siguientes maneras: Preparar sesiones: Revisar y estudiar previamente el contenido y material de cada clase para asegurar la mejor experiencia de aprendizaje. Dirigir sesiones grupales: Conducir webinars de aproximadamente 2 horas, fomentando la participación y resolución de dudas en tiempo real. Brindar mentoría individual: Ofrecer sesiones 1:1 con los estudiantes, dedicando al menos 10 horas semanales para seguimiento personalizado y orientación práctica. Comunicación constante: Mantener contacto fluido con el equipo de TripleTen en canales internos, para alinear objetivos, compartir avances y resolver cualquier inconveniente. Impacto del rol: Serás más que un tutor: te convertirás en mentor y modelo a seguir, ayudando a los estudiantes a crecer profesionalmente y a enfrentar los desafíos del mundo DA con confianza. ¡Te convertirás en su mentor y modelo a seguir! What we can offer you: Capacidad para enseñar a los estudiantes mientras desempeñas tu trabajo principal. Trabajo remoto y flexible de medio tiempo: Dedica entre 16 y 20 horas semanales (¡o más!) desde cualquier lugar. Pago competitivo: Base salarial: $200 USD al mes, que cubre onboarding, reuniones, preparación de sesiones y respuestas en canales internos. Pago por hora: $15 USD por webinars y $12 USD por sesiones 1:1. Aproximadamente $700–$1,200 USD al mes (o más, dependiendo de las horas que dediques A TT), mientras generas un impacto real en los estudiantes. Experiencia intercultural: Forma parte de un equipo internacional y conecta con estudiantes de diversos contextos. Impacto significativo: Comparte tu conocimiento y ayuda a otros a iniciar su carrera en tecnología. Participación en nuevos proyectos: Contribuye a mejorar la experiencia educativa de los estudiantes. Crecimiento profesional: Recibe retroalimentación para seguir desarrollándote como educador. Una oficina digital cómoda. Utilizamos herramientas digitales modernas — Miro, Notion, Zoom, etc. — para que el trabajo conjunto sea fluido. ¡Estamos emocionados de conocerte y trabajar contigo! ?",https://ec.indeed.com/jobs?q=analista+de+datos&l=Ecuador&radius=25&from=searchOnDesktopSerp%2Cwhereautocomplete&vjk=30a55442439bf582
9,Analista de Control y Reporting - job post,FERRERO,"Quito, Provincia de Pichincha",,,Híbrido,"Finance, Administration & Control Job ID: 71775 Quito, P, EC (Hybrid) Permanent Ecuador, Quito Plant Ferrero es una empresa familiar con una perspectiva verdaderamente mundial y progresista y marcas icónicas como Nutella®, Tic Tac®, Ferrero Rocher®, Raffaello®, Kinder Bueno® y Kinder Sorpresa®. El amor por nuestras marcas sigue creciendo al igual que lo hace nuestro alcance internacional. Representada en más de 50 países y con productos vendidos en más de 170, el Grupo Ferrero encanta a numerosas generaciones en todo el planeta. ¿Cuál es el secreto de nuestro éxito mundial? 40,000 empleados especializados que celebran tanto el cuidado como la calidad para forjar un negocio, carreras profesionales y marcas de las que nos sentimos orgullosos. Únete a nosotros, podrías ser uno de ellos. Ferrero se compromete a construir una cultura diversa e inclusiva en la que todos los empleados se sientan bienvenidos y valorados y tengan las mismas oportunidades. Estamos convencidos del talento de todos nuestros empleados. Al alimentar la curiosidad y las habilidades naturales de nuestros empleados, los empoderamos, generación tras generación, para lograr el éxito personal y profesional, permitiéndoles desarrollar su carrera en Ferrero. La diversidad de nuestros talentos es lo que hace que nuestro entorno de trabajo sea multicultural, innovador y altamente gratificante. Propósito del Cargo Elaborar y analizar los reportes económicos y financieros obtenidos de los sistemas SAP, HFM y Essbase de la compañía, con el propósito de asegurar la fiabilidad de la información, para su correcta consolidación y comparación con el presupuesto. Principales Funciones: Elaborar y organizar el Presupuesto de los Gastos de Estructura y Otros de la División Industrial a nivel Budget y Forecast a fin de obtener una proyección que permita visualizar lo que a futuro la empresa necesita incurrir. Monitorear el Headcount (Número de Personas) Actual vs lo presupuestado División Industrial a nivel Budget y Forecast para comparar lo proyectado por RRHH con la situación Actual y validar su coherencia con los gastos de Sueldos y Beneficios. Proyectar el Discretionary Cash Flow de la Compañía a nivel de Budget y Forecast. Controlar los Gastos de Estructura Actual y comparar vs Budget y SAF a través del análisis de datos y desviaciones Reportar el Profit & Loss by Destination Actual para proporcionar a casa Matriz como a la Gerencia local, la realidad de la compañía a fin contribuir en la toma de decisiones económicas. Calcular y publicar Transfer Price con el propósito de proyectar las ventas, calcular el Markup y posteriormente dar a conocer al cliente Intercompany el precio de cada producto producido. Analizar los costos Estándar y PRZ de las diferentes marcas USD/KG a fin de monitorear trend del Costo de Ventas USD/KG de los diferentes productos elaborados en planta a fin de conocer los fenómenos que impactan en el costo. Monitorear el CAPEX y verificar el cumplimiento de los objetivos establecidos desde matriz tanto de Liquidado y Carry Forward Ingresar las tarifas Primary Freight de Supply Chain en SAP para garantizar que cumplimiento de los requerimientos de los entes de control aduanero al momento de la emisión de la factura de exportación. A quién estamos buscando: Formación Académica: Estudios Superiores en Administración de Empresas, Ing. Comercial, Economía Contabilidad, Finanzas y Auditorias o carreras afines. Experiencia: 2 a 3 años en posiciones similares. Idioma: Inglés Intermedio Cómo triunfar en el puesto de trabajo y en Ferrero Consumidores, calidad y servicio son la clave de todo cuanto hacemos. Así pues, para cosechar el éxito en Ferrero, deberá orientarse al consumidor y al producto tanto como nosotros: dedicarse a lograr buenos resultados para los clientes en todo el mundo. Competencias: Pensamiento Analítico y Crítico Habilidades de Comunicación Habilidad Numérica Gestión del Cambio Orientación a Resultados Trabajo bajo presión Organización y Planificación Conocimientos Específicos: Manejo de Microsoft Office Intermedio Presupuesto NIIF SAP – Modulo CO PA Our Application Process We’re constantly looking for talented individuals who are ready to be part of our dynamic and growing organization. Ferrero is a company with a global presence and family values. Join us! 1. Apply Complete your online application, upload your CV and include brief cover letter to help us understand your experience and interests 2. Assess Our HR team will arrange a phone or video interview if we feel your qualifications are a good match for the job 3. Interview If the first interview goes well, you’ll be invited to speak with a Ferrero manager to assess your competencies, technical aptitude and fit within our dynamic organization",https://ec.indeed.com/jobs?q=analista+de+datos&l=Ecuador&radius=25&from=searchOnDesktopSerp%2Cwhereautocomplete&vjk=a2a36b6dd2f43d29
10,Analista de Planificación Financiera - job post,Grupo VILASECA,"Guayaquil, Provincia del Guayas",,,,"Responsable por controlar el uso eficiente de los recursos financieros, asegurando la optimización y sostenibilidad de las operaciones. Principales tareas y responsabilidades: Elaborar y analizar presupuestos financieros. Monitorear el desempeño financiero de la empresa. Identificar oportunidades de mejora en la gestión de recursos. Preparar informes financieros para la gerencia Colaborar en la planificación estratégica financiera. Somos Grupo VILASECA, un grupo empresarial multinacional dedicado al desarrollo y comercialización de productos y servicios en las industrias de Empaques, Alimentos, Inmobiliaria y Suministros. Haz click aquí para conocer más sobre nuestros Valores y empresas. Requisitos Graduado en Finanzas, Economía o afines Experiencia en análisis financiero y presupuestario. Conocimiento avanzado de Excel y software financiero. Habilidad para interpretar datos financieros complejos. Capacidad para trabajar bajo presión y cumplir plazos. Principales Habilidades: Análisis crítico. Comunicación efectiva. Gestión del tiempo. Resolución de problemas. Trabajo en equipo. Adaptabilidad. Beneficios Para que las personas puedan llenar el formulario, se parametrizó para que aparezca en el correo de atracción, como respuesta automática el siguiente mensaje: Al postular a esta vacante, usted otorga su consentimiento para el tratamiento de sus datos personales con el fin de llevar a cabo el proceso de reclutamiento. Sus datos serán utilizados para contactarlo, evaluar su candidatura, verificar la información proporcionada y realizar exámenes ocupacionales y de aptitud. Usted puede ejercer sus derechos de Acceso, Rectificación, Cancelación y Oposición y otros determinados en la Ley Orgánica de Protección de Datos Personales (LOPDP). Para consultar sobre los plazos de conservación de la información y otros aspectos relacionados con la protección de datos ponemos a disposición nuestra Política de Protección de Datos Personales en https://www.semvra.com/resoluciones-y-politicas . Necesitamos que llenen este formulario para la autorización de uso y manejo de datos personales: https://forms.gle/5n1LkUTkFdJoVo8V8",https://ec.indeed.com/jobs?q=analista+de+datos&l=Ecuador&radius=25&from=searchOnDesktopSerp%2Cwhereautocomplete&vjk=b7b824585c4e0dc3
11,Analista de Tecnica Aduanera - job post,DHL Express,"Guayaquil, Provincia del Guayas",,Tiempo completo,,"(25008RI) Ecuador-Guayas-Guayaquil | Full-time | Temporary | Flexible Working Times En DHL Express, nuestro propósito es “Conectar a las personas, mejorar vidas”. Somos la empresa más internacional del mundo, ""la gran máquina amarilla"", como nos encanta llamarla. Específicamente en nuestra región de América Central y del Sur, cubrimos 15 países, desde el Parque Nacional Tikal en Guatemala, hasta Ushuaia en Tierra del Fuego - Argentina. Somos más de 3.400 Especialistas Internacionales Certificados que trabajamos apasionadamente y motivados COMO UN SOLO equipo, moviendo más de 10 millones de envíos al año y superando las necesidades de nuestros clientes, mientras apoyamos sus negocios e impactamos positivamente en nuestras comunidades al mismo tiempo. Somos el Great Place to Work # 1 en América Latina y nos sentimos muy orgullosos de eso. ¡Y tenemos buenas noticias! ... Estamos buscando una Superestrella como tú, centrado en nuestros clientes y que quiera tener el mejor día, todos los días ... Propósito del Rol Es responsable de mantener los tiempos de nacionalización del material Inbound tanto en pre arribo como en arribo bajo los parámetros establecidos según procedimiento de la compañía. Principales Responsabilidades Ingreso de información de las guías a nuestros sistemas, asignación de régimen, categorización de las guías Courier, clasificación arancelaria y liquidación de impuestos. Ponerse en contacto con el cliente para obtener su información personal (datos necesarios para la declaración aduanera), confirmar contenido, uso y función de la carga y datos necesarios; notificar las guías clareadas antes del arribo y al mismo tiempo lograr su aprobación pre-autorizándola para su inmediato refrendo. Envío de notificación escrita (entrega con Courier) en caso de guías que no registren información o apertura de casos con Customer Service. Seguimiento de casos simplificados como es la categoría A (documentos y valija diplomática) realizando una correcta salida dentro del marco legal. Notificar a Billing las facturas generadas por reembarques. Enviar solicitudes de Notas de crédito al área de billing por cambios generados. La atención a llamadas telefónicas debe ser ágil y oportuna en el menor tiempo establecido. Canalizar los pagos de liquidaciones con cada Importador para no generar pagos de intereses correspondientes. Requisitos Estudios superiores culminados en Comercio Exterior. Nivel Intermedio – Avanzado Inglés Nivel Intermedio Microsoft Office Muy buen nivel de servicio al cliente Administración del Tiempo Agilidad en manejo de procesos Conocimiento en procesos aduaneros y nomenclatura arancelaria. Manejo de reclamos 2 a 3 años de Experiencia en áreas como Comercio Exterior, Procesos Aduaneros o aranceles. Posting Legal Entity DHL Express (Ecuador) S.A.",https://ec.indeed.com/jobs?q=analista+de+datos&l=Ecuador&radius=25&from=searchOnDesktopSerp%2Cwhereautocomplete&vjk=97982173ad13285a
12,Quality Control Analyst - job post,Grünenthal,"Quito, Provincia de Pichincha",,Tiempo completo,,"share mail share share Quality Control Analyst País: Ecuador Población: Quito Departamento: Global Operations & Production Job ID: 44909 Job Grade: TEC8 Hiring Manager: Carlos Oswaldo Alpusig Alpusig Empleado | Permanente | A tiempo completo/parcial | In situ Nuestro personal de Manufacturing & Global Operations comparte dos prioridades: lograr que las cosas pasen y hacer que cada vez sean mejores. Si eres una persona dinámica y con una mentalidad positiva, encajarás muy bien aquí. Somos un equipo multicultural con un gran espíritu de colaboración. Juntos, nos aseguramos de que nuestros productos cumplan con los más altos estándares de calidad mediante la búsqueda constante de formas de mejorar en cada etapa de nuestra cadena de valor, desde las materias primas que compramos hasta la red logística que lleva nuestros medicamentos a los pacientes. Únete a nuestro equipo y ayúdanos a hacer una contribución aún mayor al futuro de Grünenthal. Cómo es el trabajo Cada día disfrutarás de retos como: Guiar en los procedimientos y flujos a seguir en el caso de que se requiera en el conocimiento de los procesos relacionados de planta incluidos todos los procesos de metodología analítica y documental a Analista Control de Calidad (SE & Est) / (MP). Cuidar y manejar los instrumentos analíticos del laboratorio: HPLC, CG, espectrofotómetro IR, UV, titulador automático, determinador de agua Karl Fischer, entre otros; luego de haber cumplido los procesos de entrenamiento respectivos en el manejo de su equipo. Cuidar y gestionar reactivos, estándares, columnas e insumos para trabajo diario. Gestionar los datos analíticos en sus hojas de trabajo, tomando en cuenta datos numéricos, estadísticos, de tendencia, etc. Reportar de manera inmediata cualquier desvío y OOS de los datos generados. Actualizar, implementar y cumplir normas GMP en el Laboratorio. Cumplir con las buenas prácticas de documentación Cumplir y hacer cumplir la confidencialidad del manejo de los documentos del Laboratorio. Cumplir con los procedimientos estándar de operación que le fuera designado. Dar soporte en la investigación de resultados fuera de especificación, fuera de tendencia y fuera de expectativa. Dar soporte en la gestión de CAPAS generadas para los procesos analíticos del área. Realizar procesos de doble chequeo de la data generada en el área. Apoyar bajo requerimiento del responsable de área el soporte en la parte de ingreso de muestras y procesos administrativos relacionados y previos de cumplimiento a los procesos analíticos operativos propios del área. Generación de Certificado Analítico del Laboratorio Químico para los diversos productos y materias primas. Tu aportación: Para aprovechar al máximo este rol, deberás contar con: Profesional Químico Farmacéutico, Ingeniero Químico, Ingeniero en Procesos, Ingeniero en Productividad o carreras afines Inglés escrito y hablado. Nivel intermedio. Conocimientos básicos estadísticos. Manejo de equipos de laboratorio. Conocimientos de normas GXP relevantes. Buenos conocimientos de Word, Excel, PowerPoint. Acerca de Grünenthal Grünenthal es líder mundial en el abordaje del dolor y de enfermedades relacionadas. Como compañía farmacéutica basada en la ciencia y de propiedad familiar, contamos con una larga trayectoria llevando tratamientos innovadores y tecnología de vanguardia a pacientes de todo el mundo. Nuestro propósito es mejorar vidas – la innovación es nuestra pasión. Centramos todas nuestras actividades y esfuerzos en alcanzar nuestra visión de un mundo sin dolor. Grünenthal tiene sede en Aquisgrán, Alemania, y filiales en 28 países en Europa, Latinoamérica y Estados Unidos, nuestros productos se venden en más de 100 países. Alrededor de 4.300 profesionales trabajan en Grünenthal y en 2024 alcanzó unos ingresos de aproximadamente 1.800 millones de euros. Tu contacto en Recursos Humanos: Pamela Aguirre Burgos",https://ec.indeed.com/jobs?q=analista+de+datos&l=Ecuador&radius=25&from=searchOnDesktopSerp%2Cwhereautocomplete&vjk=a15748a9f9ac6b5b
13,Data Analytics Teaching Experts LATAM - job post,TripleTen,Desde casa,,Tiempo parcial,Presencial,"TripleTen es un servicio que empodera a las personas, sin importar su experiencia previa, para embarcarse en el emocionante y desafiante camino de dominar profesiones tecnológicas. Nuestros bootcamps se enfocan en capacitar a los estudiantes en ingeniería de software, ciencia de datos, análisis de business intelligence y ingeniería de aseguramiento de calidad (QA), de una manera accesible y viable, llevándolos finalmente a prosperar en una nueva carrera. Nuestra misión es garantizar que cada estudiante tenga la oportunidad de dominar con éxito una nueva profesión, encontrar su propósito y convertirse en un miembro valioso de la industria tecnológica. ¿Cuál es nuestro objetivo? Estamos en búsqueda continua de analistas de datos con experiencia para mentorizar a nuestros estudiantes y ayudarlos a convertirse en desarrolladores profesionales. Puedes unirte a nosotros a tiempo parcial, dedicando de 10 a 20 horas por semana, según tu disponibilidad. Puedes postularte aquí — revisamos las solicitudes de manera continua e invitamos a los candidatos seleccionados a una entrevista en video y una tarea de prueba. Si hay un puesto disponible, te lo asignaremos de inmediato; si no, guardaremos tu perfil y la tarea completada para futuras oportunidades. Por favor, envía tu CV en inglés. Requirements: +2 años de experiencia trabajando como analista de datos. Conocimiento de Python a nivel profesional resolviendo problemas de negocio (idealmente con al menos 3 años de experiencia). +1 año de experiencia trabajando con SQL en problemas reales, visualizaciones, estadística y probabilidad, y Excel. Experiencia con bibliotecas de Data Wrangling como Pandas, NumPy, Matplotlib, etc. Inglés intermedio, español avanzado. What you will do: Hay 2 roles de enseñanza para los estudiantes: Tutores y Instructores. Los Tutores apoyan a los estudiantes respondiendo sus preguntas y brindando orientación práctica a través de: Realización de webinarios en video (una o dos veces por semana) Chats con los estudiantes Sesiones de live coding (una sesión en vivo cada dos semanas) Este rol requiere 15 a 20 horas de disponibilidad, con énfasis en el horario de 7pm a 10pm hora CDMX (lunes a viernes). Como Instructor, tu misión es ayudar a los estudiantes a resolver todas las dudas sobre el contenido del programa y guiarlos a través de ejercicios y proyectos. Tú: Asistirás a los estudiantes vía Discord, en canales escritos y de voz Realizarás sesiones de preguntas y respuestas (Q&A) Este rol requiere 12 a 15 horas de disponibilidad, con énfasis en el horario de 7pm a 10pm hora CDMX (lunes a viernes). Y lo más importante: ¡serás una persona a la que tus estudiantes admirarán! What we can offer you: Capacitación en técnicas de mentoría y comunicación. Capacidad para enseñar a los estudiantes mientras desempeñas tu trabajo principal. Compartir experiencia con desarrolladares dentro de nuestra comunidad. Ingresos promedio de $700 a $900 USD al mes por una colaboración flexible de medio tiempo, con gran impacto ¡y un equipo increíble! Experiencia de colaboración intercultural en mentoría y realización de webinarios. Cooperación remota con un horario conveniente tanto para ti como para el equipo. No nos enfocamos en la microgestión. Una oficina digital cómoda. Utilizamos herramientas digitales modernas — Miro, Notion, Zoom, etc. — para que el trabajo conjunto sea fluido. Un equipo diverso y unido distribuido entre EE.UU. y América Latina.",https://ec.indeed.com/jobs?q=analista+de+datos&l=Ecuador&radius=25&from=searchOnDesktopSerp%2Cwhereautocomplete&vjk=a0272642a524d1a9
14,ANALISTA MERCADEO - job post,PLASTICAUCHO INDUSTRIAL,"Ambato, Provincia del Tungurahua",,,,"OBJETIVO : brindar apoyo en actividades de campo, con el fin de recopilar y facilitar información del consumidor y competencia, en gestiones operativas/logísticas relacionadas a lanzamientos, publicidad y reportería. FUNCIONES Levantar información de mercado. Gestionar la logística y ejecución de los lanzamientos comerciales a la fuerza de ventas o clientes. Dar soporte a los intercambios de información entre las agencias publicitarias (digital y tradicional) y la compañía. Apoyo en lanzamientos de temporada Dar apoyo en actividades publicitarias ATL y BTL Intégrate a Plasticaucho Industrial líder de la industria del calzado del centro del país, contamos con varias líneas; Lona, Escolar, Plástico, Relax e Industrias Diversas. Somos una empresa orgullosamente Ambateña buscando permanentemente la mejora continua de nuestros procesos. Buscamos profesionales con iniciativa y visión al desarrollo de sus actividades, guiados por los valores y cultura organizacional de nuestra empresa. Ofrecemos un trabajo estable y con oportunidades de hacer una carrera profesional, tenemos una cultura guiada a nuestros colaboradores brindando bienestar a través del cumplimiento de la legislación aplicable. Requisitos FORMACION ACADÉMICA: Ingeniería en Marketing, Comercial, Mercadotecnia, Ventas, Administración de Empresas o afines EXPERIENCIA: 1 año de experiencia ejecutando actividades relacionadas a: Marketing, Trade Marketing o Ventas, CONOCIMIENTOS: Excel (avanzado) Análisis de Datos Marketing ATL / BTL Ingles Intermedio REQUISITO ADICIONAL: Disponibilidad para viajar Poseer Licencia tipo B/C Beneficios Beneficios de Ley Beneficios Empresariales Alimentación Uniformes Transporte Vehículo Viáticos",https://ec.indeed.com/jobs?q=analista+de+datos&l=Ecuador&radius=25&from=searchOnDesktopSerp%2Cwhereautocomplete&vjk=0e8b3b7680ca51f2
